id,name,tagline,desc,website,category,thumbnail,votes,comments,createdAt,launchedAt
379737,Ligalio,Take care of the legal stuff for your website or app,"In minutes, generate a personalised, GDPR-ready privacy policy for your website or app. Try out without registration. Used by 300+ startups. Works for both, EU and US businesses. Built for non-lawyers. Don't leave your business's compliance to chance.",https://ligalio.com,"SaaS,Privacy,Legal",https://ph-files.imgix.net/fce7107e-999e-40d0-9f76-560279bbd252.png?auto=format,216,64,2023-02-23T08:01:00Z,2023-02-23T08:01:00Z
380905,Spotify DJ,"AI DJ, right in your pocket","Spotify reimagined the way you can listen to Spotify with AI. Never before has listening felt so completely personal, thanks to the powerful combination of Spotify’s personalization technology and Generative AI through the use of OpenAI technology.",https://open.spotify.com/__noul__,"Music,Spotify,Artificial Intelligence",https://ph-files.imgix.net/9b4425aa-b44b-4ed2-9fd3-011a851bbf09.png?auto=format,195,21,2023-02-23T08:01:00Z,2023-02-23T08:01:00Z
380870,Humans of PLG,Stories of your favorite products - from those who made them,We pick the brains of the humans driving product-led growth at the hottest SaaS companies in the world. And uncover what aspiring PLG companies can learn from how they built and scaled the products you use every day.,https://www.toplyne.io/humans-of-plg,"SaaS,Startup Lessons,Business",https://ph-files.imgix.net/8b0ffdb3-09c8-46bc-a9e8-6b8533da9a88.png?auto=format,184,59,2023-02-23T08:01:00Z,2023-02-23T08:01:00Z
380989,YouRate,Your universal rate card,"Explore hourly talent rates at software development agencies across 35 countries: by location, tech stack, and years of experience. Made with ❤️ by YouTeam.",https://youteam.io/talents-rates,"Hiring,Software Engineering,Tech",https://ph-files.imgix.net/ee34b512-eb74-4c5c-90dc-93c051594ac4.gif?auto=format,151,24,2023-02-23T08:01:49Z,2023-02-23T08:01:49Z
380904,Notion Charts,Create beautiful charts for your Notion pages,Create stunning charts in any Notion project using one of these amazing tools. Some allow you to sync the charts directly to a Notion database!,https://notion-charts.com,"Data & Analytics,Data Visualization,Notion",https://ph-files.imgix.net/93818390-41b9-40bf-97d5-83abbf0cefe9.png?auto=format,140,17,2023-02-23T08:14:17Z,2023-02-23T08:14:17Z
380812,Tickertape,Meet your 'all-things-investing' mate,"Tickertape is an investment analysis tool that provides up-to-date market information, powerful analysis tools, rich insights & allows users to make market transactions. It helps investors make data-driven decisions to achieve their financial goals.",https://www.tickertape.in,"Fintech,Investing,Personal Finance",https://ph-files.imgix.net/444dd196-b5b9-4ffd-b56c-036a70dbd272.png?auto=format,137,14,2023-02-23T08:00:00Z,2023-02-23T08:00:00Z
380901,Phind.com,The best of ChatGPT combined with the best of Google,"Phind is a conversational search engine for developers. It combines web results with generative AI to give you answers, code examples, and guides. Dive in deeper by asking followup questions — Phind understands the context of your conversation.",https://phind.com,"Developer Tools,Artificial Intelligence,Search",https://ph-files.imgix.net/8c1aaefe-2ff2-4dad-ac9f-22c7c1fa6992.png?auto=format,111,19,2023-02-23T08:01:00Z,2023-02-23T08:01:00Z
379143,Childbook AI,Create your own children's book that you can read/listen to,Based on your title and short description with help of GPT-3 we will generate a unique children's story. You can personalize the characters in the book and it will contain matching illustrations. You can read the book or play it like an audiobook.,https://www.childbook.ai/,"Kids,Artificial Intelligence,Books",https://ph-files.imgix.net/bc700ff1-cb86-4024-935f-65d73c364f90.jpeg?auto=format,108,25,2023-02-23T08:22:31Z,2023-02-23T08:22:31Z
380960,Reader,Sign up today and find your next great read on Reader,"Discover the latest content from top blogs and publications with Reader - the ultimate app for staying informed and exploring new interests. With a more than a thousand sources, Reader delivers personalized content without the noise. Try it now!",https://reader.place,"News,Writing,Social Media",https://ph-files.imgix.net/e85a4d06-5b9a-4826-972e-d04eb699f875.png?auto=format,90,22,2023-02-23T08:01:00Z,2023-02-23T08:01:00Z
380990,Bring Hope With a Donation Popup,"Help earthquake victims in Türkiye, it’s time to unite",Let's stand together and show our support for Türkiye! 🇹🇷💪 Our new non-profit widget makes adding donation opportunities for recent earthquakes easy on your website and encourages visitors to donate to earthquake victims while spreading awareness.,https://helpturkiyepopup.com/,Charity & Giving,https://ph-files.imgix.net/8d8f29bc-14aa-4306-b4b9-ff7ec87fc607.gif?auto=format,77,7,2023-02-23T08:22:01Z,2023-02-23T08:22:01Z
381022,Chunky,Create specialized GPT-powered agents for your company,"Quickly & easily create your own GPT-powered, specialized agents. Create chatbots that behave similar to ChatGPT but are trained on your own data. Smart specialized chatbots for your website or knowledge base bots for your team. Simply with a Google Sheet!",https://getchunky.io/,Artificial Intelligence,https://ph-files.imgix.net/cac68a0c-016e-4954-b5cf-427b3399dae4.png?auto=format,75,15,2023-02-23T11:00:23Z,2023-02-23T11:00:23Z
379918,UX Stack Guru,Boost efficiency and productivity of UX process in Figma,"Boost your efficiency and productivity in Figma/FigJam, with a complete set of tools for designers in their day-to-day UX process. Thanks to UX Stack Guru for Figma you can eliminate the need for multiple UX tools and subscriptions.",https://uxstackguru.gumroad.com/l/bwikur,"Design Tools,Productivity,User Experience",https://ph-files.imgix.net/9da5f08d-9257-4e80-9636-87b373470221.png?auto=format,63,12,2023-02-23T08:21:56Z,2023-02-23T08:21:56Z
380800,Sandworm,Keep your JavaScript code secure and compliant with Sandworm,"Sandworm audits your project and dependencies for vulnerabilities, license issues, and more. Works with any JS package manager, generates visualizations and a CSV report about license info. Secure and ensure compliance for your app's dependencies.",https://sandworm.dev/,"Developer Tools,Security",https://ph-files.imgix.net/fdd02d76-61bf-4cc4-bb75-39f8d5aa84fb.png?auto=format,667,64,2023-02-24T08:01:00Z,2023-02-24T08:01:00Z
380547,Dodgeball,Get fraud-stack as a service,"One integration to build the perfect fraud stack. Dodgeball hooks into signup, sign-in, payments, etc. tracks your users, runs drag & drop automated workflows (logic, smart friction & 3rd-party fraud tools), and returns a response (approve, deny, or review).",https://www.dodgeballhq.com,"Payments,Developer Tools,Security",https://ph-files.imgix.net/32240c2a-e49f-4dc1-a34a-ab24edee4616.png?auto=format,646,38,2023-02-24T08:04:56Z,2023-02-24T08:04:56Z
380933,Marketing Blocks Web App,Instantly generate marketing copy for your business,Turn an idea into a business that gets results in 45 seconds using only a keyword. Insert a keyword & MarketingBlocks will generate the assets needed to market the business; - Landing Page - Social Media Ads - Logo - Marketing Copy - Branding Kit - Graphics,https://marketingblocks.ai/cb/,"Design Tools,Artificial Intelligence,Marketing automation",https://ph-files.imgix.net/eda181ce-3182-4be1-86e1-baacb15ba813.jpeg?auto=format,350,50,2023-02-24T08:05:24Z,2023-02-24T08:05:24Z
380673,EzMail.AI,Reply to emails 10X faster with pre-filled drafts by AI,"EzMail.AI is the AI-powered Gmail drafting tool that pre-fills personalized responses in your own writing style, enabling you to reply to emails 10X faster. It's a big time saver if you frequently write similar responses. It works on both mobile and desktop.",https://www.ezmail.ai/,"Email,Productivity,Artificial Intelligence",https://ph-files.imgix.net/af2637f0-4767-436a-a58c-523c9ab565b1.png?auto=format,301,90,2023-02-24T08:05:40Z,2023-02-24T08:05:40Z
381024,Ads Revenue Calculator,Check your potential e-comm revenue from Google Search Ads,Ads Revenue Calculator allows e-commerce businesses to forecast the potential revenue they can generate by Google Search Ads within seconds. Our solution is at its Beta version now and will be improved with new capabilities and features. Stay tuned!,https://usemagnetiq.com/en/ecommerce-revenue-calculator,"Marketing,Advertising,E-Commerce",https://ph-files.imgix.net/78f54953-2b4c-4697-a729-1053c1a3080e.gif?auto=format,271,129,2023-02-24T08:01:00Z,2023-02-24T08:01:00Z
381060,CassetteAI,"The AI-powered music producer, create your dream music","Cassette AI is the ultimate tool for anyone looking to create stunning, royalty-free music instantly. Whether you're a professional music producer or just starting out, Cassette will help you create high-quality beats instantly just based on your thoughts!",https://cassetteai.com/,"Music,Audio",https://ph-files.imgix.net/97b5b9ce-5d44-417e-9022-412752d6a958.png?auto=format,256,35,2023-02-24T08:01:00Z,2023-02-24T08:01:00Z
380084,100 ChatGPT Audience Building Prompts,Collection of ChatGPT prompts to help you build an audience,"This collection of ChatGPT prompts will help you make the most of this new AI tool to supercharge your knowledge on building an audience on Twitter, Instagram, TikTok and YouTube.",https://pascio.gumroad.com/l/100abprompts,"Social Media,Social media marketing,Notion",https://ph-files.imgix.net/1b063bef-9862-4df1-adce-7b3e82b301f8.png?auto=format,218,49,2023-02-24T08:01:00Z,2023-02-24T08:01:00Z
380714,Accio,"GPT-powered, instant resume summary generator",It is hard for recruiters to understand if a candidate is fit for a role from just doing a cursory scan of their resume. Accio helps generate instant summary of a resume to help recruiters and hiring managers be more productive and fair (to candidates).,https://bubble.io/domain_not_supported,"Hiring,Productivity,Artificial Intelligence",https://ph-files.imgix.net/0dd75c5e-952b-42e7-819b-ecac698e2409.png?auto=format,207,11,2023-02-24T08:01:00Z,2023-02-24T08:01:00Z
380957,PromptPlays.ai,AI-Infused Apple Shortcuts. Endless Possibilities.,PromptPlays are Apple Shortcuts that harness the power of Large Language Models (like GPT).,https://www.promptplays.ai/,"Productivity,Artificial Intelligence",https://ph-files.imgix.net/491eb1e4-3a22-4646-a321-4f14127e69fd.png?auto=format,175,27,2023-02-24T08:01:00Z,2023-02-24T08:01:00Z
381084,AnyAPI,Add AI power to your product in minutes,Craft the perfect GPT-3 prompt with A/B testing and get a live API endpoint ready to power your next AI feature.,https://anyapi.netlify.app,"API,Developer Tools,Artificial Intelligence",https://ph-files.imgix.net/62bcada9-1c4e-49d6-998c-1bfdc9083fd9.png?auto=format,161,12,2023-02-24T08:01:44Z,2023-02-24T08:01:44Z
381037,Zero To Founder,A book to help you build profitable products,"This book is for anyone who wants to dive deep and understand the ecosystem around building profitable products. Each topic in this book covers various steps to speed up the development of your product, validate your product/reach much faster.",https://upen.gumroad.com/l/zero-to-founder-the-micro-saas-builders-handbook,"Startup Books,SaaS,Side Project",https://ph-files.imgix.net/09b56358-099d-4e69-b137-2d7e3757f2f4.png?auto=format,158,82,2023-02-24T08:04:36Z,2023-02-24T08:04:36Z
381091,Gift Hunt,The WordPress plugin for hidden surprises and gift hunts,"Boost engagement, build brand loyalty, and increase conversions with the free Gift Hunt plugin! Easily hide surprise gifts for your visitors, offering them a unique and memorable experience. Don't miss out on the fun - install Gift Hunt today! 🎁",https://ecommerce-platforms.com/gift-hunt,"User Experience,Marketing,WordPress,Growth Hacks ",https://ph-files.imgix.net/e534e817-b2e2-4f2f-8f95-6cd0ca569c70.gif?auto=format,140,76,2023-02-24T08:00:36Z,2023-02-24T08:00:36Z
381112,CornerBoyz MysteryBox,Premium cannabis subscription box using NFTs,The MysteryBox is a CornerBoyz + Brand collaboration featuring one Digital Collectible Branded MysteryBox NFT with virtual benefits and one Physical Box delivered to the CornerBoyz address every month.,https://cornerboyz.club/,"Cannabis,Web3,NFT",https://ph-files.imgix.net/186e85af-ee7a-4a83-888e-5571d000a148.jpeg?auto=format,116,6,2023-02-24T08:04:17Z,2023-02-24T08:04:17Z
381148,Teaming,"The OS for healthy, high-performing teams","Teaming is a team operating system for YOUR team. It learns who we are and provides private, contextual, and adaptive recommendations for each of us to solve problems and conflicts together. These recommendations are delivered real-time in your 1:1s, team meetings, feedback sessions, goal reviews, etc.",https://www.teaming.com,"Productivity,Task Management,Meetings",https://ph-files.imgix.net/663623ae-d666-4363-a53e-e8714a086f26.png?auto=format,104,61,2023-02-24T08:01:52Z,2023-02-24T08:01:52Z
381070,Lasting Dynamics Newbie Academy,Start your journey in the IT world and build your career,"Make your first step into the IT world, and learn the basics of software development in just 5 months. There are 3 paths you can choose: Front-end development, IT Project Management & Quality Assurance, and UI/UX Design. You get resources to learn and regular calls with mentors to get feedback.",https://www.lastingdynamics.com/newbie-academy-badge/,"Education,Software Engineering,Career",https://ph-files.imgix.net/61bb2ea8-a9e0-4e76-a00a-297aa60ff510.png?auto=format,94,94,2023-02-24T08:37:59Z,2023-02-24T08:37:59Z
381096,Windstatic,Free Tailwind & Alpine elements/layouts ready to copy-paste,A free collection of aesthetically designed elements & layouts made with Tailwind CSS and Alpine.js ready to copy n' paste into your next project!,https://windstatic.com/,"Design Tools,Productivity,Developer Tools",https://ph-files.imgix.net/d4cd1074-aacb-46bd-9da3-76c15ba48873.png?auto=format,92,22,2023-02-24T08:02:00Z,2023-02-24T08:02:00Z
379594,TRACX,A beautifully simple set of AI assisted marketing tools,"All your marketing needs in one place. 🚀 Gather feedback, create promotions, conduct market research, and collect leads with TRACX. Our AI assistant helps you create forms, surveys and landing pages in seconds. 🧠",https://app.tracx.com/register,"Marketing,SaaS,Artificial Intelligence",https://ph-files.imgix.net/4e90578e-80d6-4cc4-a7fd-d0b6f1c3236a.gif?auto=format,85,6,2023-02-24T08:01:00Z,2023-02-24T08:01:00Z
381100,Venngage Color Blind Simulator,Create accessible designs that everyone can appreciate.,"The Venngage Color Blind Simulator allows you to see how your website looks to an audience with color blindness and other visual impairments, and create accessible designs everyone can appreciate. Break down visual barriers with this free color blind checker.",https://venngage.com/tools/color-blind-simulator,"Design Tools,Web Design,Inclusivity",https://ph-files.imgix.net/ea59237c-28a3-409b-88da-4ec2e4387882.png?auto=format,81,23,2023-02-24T08:02:21Z,2023-02-24T08:02:21Z
381212,Encrypted Photo Filtering App,Encrypted image filtering using homomorphic encryption,Today we're happy to release a real-life use case of Fully Homomorphic Encryption (FHE): an encrypted image filtering app using FHE. You can check it out here: https://huggingface.co/spaces/zama-fhe/encrypted_image_filtering,https://huggingface.co/spaces/zama-fhe/encrypted_image_filtering,"Crypto,Artificial Intelligence,Security",https://ph-files.imgix.net/d6cb19e3-8367-4c2c-a786-a67b52055a8f.png?auto=format,80,16,2023-02-24T12:49:02Z,2023-02-24T12:49:02Z
378847,Birdy,Get more Twitter followers. Twitter profile A/B testing,Birdy helps you optimize your Twitter profile with automated A/B testing. Create two profile versions and let Birdy determine which one converts more visitors into followers.,https://birdy.so,"Twitter,A/B Testing,Social media marketing",https://ph-files.imgix.net/e7245d8e-5c7a-4515-88ec-dfd4604a10b6.gif?auto=format,731,286,2023-02-25T08:27:02Z,2023-02-25T08:27:02Z
381274,Startupers from Adstra,30+ solutions to idea validation problems,Unlock the potential of the right information at the right time. See what problems related to idea validation people tackle and how they solve them.,https://adstra.ai/startupers,Productivity,https://ph-files.imgix.net/c69b02ac-e92c-46ac-af77-d16fadf20b30.jpeg?auto=format,318,56,2023-02-25T08:33:47Z,2023-02-25T08:33:47Z
381254,No-code AI Avatar Blueprint,Build an Avatar that remembers your stuff,"Imagine your own AI Avatar-assistant capable of remembering your notes and helping you find relevant information. It can even perform actions on your behalf, using API nad no-code tools. 🗺️ Use this free blueprint to make your own Avatar and see how I made mine!",https://overment.gumroad.com/l/avatar,"Productivity,Developer Tools,Artificial Intelligence",https://ph-files.imgix.net/cea82eb3-a532-4fe5-9d0a-f978116c8386.png?auto=format,311,51,2023-02-25T08:01:00Z,2023-02-25T08:01:00Z
381300,100+ Startup Roles Prompt Templates,Supercharge your business with a collection of AI employees,"As a startup owner, expanding your business without a team can be tough. But what if you could access 100 AI Startup Role Prompts to automate and simulate employees? That's precisely what my templates offer.",https://theveller.gumroad.com/l/StartupRolesPromptTemplates-byTheVeller,"Artificial Intelligence,Business,Notion",https://ph-files.imgix.net/d10bd08a-d43d-40a5-9c3a-e760ce1cc92b.gif?auto=format,302,41,2023-02-25T08:53:22Z,2023-02-25T08:53:22Z
378597,Collabwriting for PDF,Collaborate around what you find online on the Web or PDFs,"Collabwriting is the simplest way to collaborate around online research. You can easily highlight webpages, PDFs and share your research with others 😄 Thank you for your support! 🍀 Use PH55 to get 55% OFF Personal Pro 🤩🎁",https://collabwriting.com/pdf,"Browser Extensions,Productivity,SaaS",https://ph-files.imgix.net/19034657-d4a7-4be3-ba73-7d9f48b856a9.gif?auto=format,283,97,2023-02-25T08:14:58Z,2023-02-25T08:14:58Z
377520,Daily App,"Tired of a full schedule, look no further",Are you tired of the tedious and time-consuming process of daily reporting for your team? Look no further and try Daily App today for free!,https://www.thedaily.app/,"Productivity,Meetings,Developer Tools",https://ph-files.imgix.net/ac6af44b-5a5b-49d4-845a-e576d3717a76.png?auto=format,191,125,2023-02-25T08:38:50Z,2023-02-25T08:38:50Z
380849,Code Snippets AI,"Generate, refactor & debug with GPT-4. All inside VSCode","Become a smarter programmer with the help of AI. Generate, Refactor, Debug & Document your code in your VSCode editor. Powered by GPT-4.",https://marketplace.visualstudio.com/items,"Productivity,Developer Tools,Artificial Intelligence,Tech,Development",https://ph-files.imgix.net/91ff790f-35c0-4e28-b0f0-78be9ef962ae.png?auto=format,130,35,2023-02-25T08:59:48Z,2023-02-25T08:59:48Z
381305,Wizi AI,GPT-3 powered code search for frontend teams,"Wizi is an AI agent for common frontend tasks. We are releasing our Code Search feature –&nbsp;instant natural language search for React (JS/TS) codebases as an open-source, self-hosted tool.",https://wizi.ai,"Developer Tools,Artificial Intelligence",https://ph-files.imgix.net/46cbf96f-52c1-4a51-b735-772118871f94.gif?auto=format,128,47,2023-02-25T08:35:34Z,2023-02-25T08:35:34Z
381272,LLaMA,"A foundational, 65-billion-parameter large language model","LLaMA is a collection of foundation language models ranging from 7B to 65B parameters and show that it is possible to train state-of-the-art models using publicly available datasets exclusively, without resorting to proprietary and inaccessible datasets.",https://research.facebook.com/publications/llama-open-and-efficient-foundation-language-models/,"Open Source,Artificial Intelligence,GitHub",https://ph-files.imgix.net/52195bb8-3308-464b-ad4b-2d4a7f41977d.png?auto=format,103,8,2023-02-25T08:01:00Z,2023-02-25T08:01:00Z
381197,DALL·E Cli,"Image generation, editing & filters from the command line","Powerful & easy-to-use tool that harnesses the OpenAI DALL-E API to generate, edit and filter images from the cmd line. With a few simple commands, users can create stunning images, apply various effects, filters and enhance their creativity like never before.",https://dallecli.com,"Design Tools,Productivity,GitHub,Digital Art",https://ph-files.imgix.net/7042b4bd-343e-4b02-8f04-ee475a6df9e6.png?auto=format,80,33,2023-02-25T08:50:42Z,2023-02-25T08:50:42Z
381256,ChatGPT Optimizer for Chrome,This extension adds features to the ChatGPT website,"Boost your AI workflow with this extension. After installing this extension you'll experience a much nicer ChatGPT version: Copy/Read messages, download chats, upload documents, prompt assistance, themes, and every feature you'd like we implement within days!",https://productivity.rocks/tool/ai-optimizer/,"Productivity,User Experience,Artificial Intelligence",https://ph-files.imgix.net/0c2e4ca4-4292-4deb-912c-14699590aa3f.png?auto=format,77,6,2023-02-25T08:01:00Z,2023-02-25T08:01:00Z
380903,UX Must Follow,"Follow them for design insights, and a little bit of UX fun","Curated by Arvin Dizon & Designed by Manuel Ogomigo. Follow them for design goodness, insightful tips, and a little bit of UX fun! Let’s go! 🤘",https://uxmustfollow.webflow.io,"User Experience,UX Design",https://ph-files.imgix.net/b61365e3-47cf-4aa8-9da9-e84c52938d46.png?auto=format,68,10,2023-02-25T09:00:55Z,2023-02-25T09:00:55Z
381232,Prompt Hackers,Newsletter sharing high quality AI art prompts,"Sharing AI Art Prompts - This is a daily-ish newsletter covering the emerging art of A.I. Prompt Engineering. Often delivered with a caustic or pithy wit, it’s a reference guide to creating A.I. Prompts that deliver awesome results.&nbsp;",https://prompthackers.substack.com,"Newsletters,Digital Art,NFT",https://ph-files.imgix.net/571a7a77-285a-4451-b759-829eb2154621.jpeg?auto=format,58,13,2023-02-25T08:01:00Z,2023-02-25T08:01:00Z
381281,Chord,AI research engine for organic recommendations,"Chord is an AI engine that does real-time research on recommendations for products, books, and more. It's like crowdsourced Wirecutter: our AI ""research team"" scours the web for organic discussion on your personal rabbit hole, then composes in-depth articles.",https://chord.pub/,"Social Network,Artificial Intelligence,E-Commerce",https://ph-files.imgix.net/3972bc4d-488d-4506-ad23-2fa1d958de14.png?auto=format,57,10,2023-02-25T08:37:20Z,2023-02-25T08:37:20Z
381297,Juta,Your personal finance tracker,"Are you tired of feeling overwhelmed by your finances? Introduce Juta, the personal finance tracking app that makes managing your money easy and stress-free!",https://juta-web.vercel.app,"Android,Money,Finance,Personal Finance",https://ph-files.imgix.net/e9ecc55a-5d73-40f8-8053-47e90e00b5b7.png?auto=format,57,11,2023-02-25T08:24:17Z,2023-02-25T08:24:17Z
380961,Meetsummary,Automated meeting summaries,MeetSummary is a super easy-to-use AI bot that automatically generates summaries of your meetings. Just invite the bot to your meeting and receive the summary in your email inbox.,https://meetsummary.com,"Productivity,Artificial Intelligence,Tech",https://ph-files.imgix.net/b8f0a662-f517-4f7f-80f4-35937b112e0c.png?auto=format,54,20,2023-02-25T08:51:39Z,2023-02-25T08:51:39Z
379972,WebStickies,Sticky notes for the Internet,Take notes on websites! Features: - Attach notes to specific websites or match multiple URLs with regex. - Sync notes across all devices. - Organize notes with tags and folders. - Privacy focused.,https://lawrencehook.com/ws/,"Browser Extensions,Chrome Extensions,Productivity,Notes",https://ph-files.imgix.net/5ae1ebc5-ca28-4020-b376-15aa36811ca2.png?auto=format,38,7,2023-02-25T09:00:41Z,2023-02-25T09:00:41Z
381288,Collet,A social platform for shaping & sharing your collections,"Collet is a community of collectors where you could upload and explore a variety of collectibles from traditional art to comics and NFTs, get market insights, and shape your unique collections.",https://incollet.com/,"News,Social Media,Community",https://ph-files.imgix.net/8ef6a3c1-3c1c-4722-af18-9de9ff8b8516.png?auto=format,37,9,2023-02-25T08:40:11Z,2023-02-25T08:40:11Z
380087,Daily Reflection Journal,Grow as a person with daily reflections,Daily reflection journal template for Notion is made to help you reflect and journal digitally.,https://pascio.gumroad.com/l/dailyreflectionjournal,"Writing,Quantified Self,Notion",https://ph-files.imgix.net/bc1ae54a-b071-47ed-b1b3-42fe49194922.png?auto=format,36,2,2023-02-25T08:41:38Z,2023-02-25T08:41:38Z
381246,Mocaa,Connecting students with college counselors for 1-1 guidance,"College applications are stressful and confusing, but it doesn't have to be. With Mocaa, students can easily access a network of college counselors, compare their profiles, and request services. It's a ""must-have"" for ambitious students who want to get into their top school choices.",https://mocaa.com,"Web App,Education,E-Commerce",https://ph-files.imgix.net/9bd86fdc-a7ba-4a00-a372-bfd674246eae.png?auto=format,33,5,2023-02-25T08:01:00Z,2023-02-25T08:01:00Z
378858,LIKN,Link your content to Web3,"LIKN is a powerful, but simple Web3 component and protocol. Connect Web2 content to Web3, and solely mint content NFTs by URL. Share and Trade in different platforms and marketplaces. OpenAI empowers LIKN which can automatically generate NFT metadata.",https://likn.co/,"Productivity,Web3,NFT",https://ph-files.imgix.net/48cac417-fc00-437b-b3ba-72abb2363833.png?auto=format,377,59,2023-02-26T08:05:14Z,2023-02-26T08:05:14Z
