id,name,tagline,desc,website,category,thumbnail,votes,comments,createdAt,launchedAt
376457,Maven Course Builder,Earn 6 figures teaching what you love,"Maven Course Builder is an all-in-one platform to monetize your expertise, reach students, and earn money. Get discovered on the #1 marketplace for live learning where 15,000 professionals have taken courses. Earn ~$20,000 per cohort. Get started for free.",https://maven.com/start,"Education,Tech,Online Learning",https://ph-files.imgix.net/2034e988-7971-40e3-85cc-cc7872d96d6e.jpeg?auto=format,1433,352,2023-02-01T08:01:00Z,2023-02-01T08:01:00Z
377500,Kodezi 2.0,Grammarly for programmers,"Kodezi is an AI developer tool platform built for productivity. 🛠️ Automated code debugging with detailed explanations. ⌨️ Generate code from instructions 💬 Ask, search, retrieve anything from your codebase! 👉 and much more! Try it out kodezi.com",https://kodezi.com/,"Productivity,Developer Tools,Artificial Intelligence,Tech",https://ph-files.imgix.net/ecd0195b-817c-4a9d-8ba7-41ae06a68adf.gif?auto=format,1362,126,2023-02-01T08:01:00Z,2023-02-01T08:01:00Z
376667,SocialBu,AI-powered complete social media management tool,"SocialBu helps you to improve your social media presence and maximize your results. Publish, Generate (AI-content writer), Respond, Analyze, and Automate - all from within SocialBu.",https://socialbu.com/,"Productivity,Marketing,Artificial Intelligence",https://ph-files.imgix.net/87108d7a-b5bc-4147-84f4-9e3003c1ce6a.gif?auto=format,508,209,2023-02-01T08:03:21Z,2023-02-01T08:03:21Z
377554,OpenAI in HubSpot CRM,Bring OpenAI/GPT-3 into HubSpot Workflows,"We’re excited to share our new integration of HubSpot Workflows with OpenAI/GPT-3. With this integration, you can use natural language to easily process leads, answer customer requests and manage data.",https://www.resonatehq.com/openai-gpt-3-integration-with-hubspot,"Customer Success,Artificial Intelligence,CRM",https://ph-files.imgix.net/cf08c05a-12d1-4631-82a4-7b69510334a5.png?auto=format,459,15,2023-02-01T12:09:18Z,2023-02-01T12:09:18Z
377518,Marketing Calendar & Planner 2023,Save 30+ hours with this marketing ideas generator,"📅 Get month-wise ideas for your marketing campaign. 🌎 Filter calendar events based on geography, B2B/B2C, etc. 🌐 Import project plan into Airtable, Clickup, Notion, Google Calendar, Sheets, and Trello. 💌 Use 50+ ready-to-use interactive email templates.",https://www.mailmodo.com/tools/marketing-calendar/,"Task Management,Marketing,Calendar",https://ph-files.imgix.net/22210b17-3973-434f-81a9-96308254e9ac.gif?auto=format,447,120,2023-02-01T08:01:00Z,2023-02-01T08:01:00Z
377470,AI Text Classifier by OpenAI,New AI classifier for indicating AI-written text,"The AI Text Classifier is a fine-tuned GPT model that predicts how likely it is that a piece of text was generated by AI from a variety of sources, such as ChatGPT. This classifier is available as a tool to spark discussions on AI literacy.",https://openai.com/blog/new-ai-classifier-for-indicating-ai-written-text/,"Artificial Intelligence,Bots",https://ph-files.imgix.net/b79a63de-a5d3-41e8-9c07-eff726116ac6.png?auto=format,418,17,2023-02-01T08:01:00Z,2023-02-01T08:01:00Z
377408,Humance,Change the world supporting projects around the globe,"Discover and support unique projects around the world. Grow coral in the Pacific Ocean, plant mangroves in the Philippines, remove plastic from the ocean, provide cars and drones to the Armed Forces of Ukraine, and much more just in a few clicks.",https://humance.io/en,"Charity & Giving,Climate Tech,Social Impact",https://ph-files.imgix.net/bb8ace02-81fe-42b1-ab5c-20019685a872.gif?auto=format,297,88,2023-02-01T09:17:48Z,2023-02-01T09:17:48Z
377614,IntelliMail,Your personal AI email assistant.,Chrome extension to write emails using AI.,https://www.intellimail.xyz/,"Chrome Extensions,Email,Productivity,Artificial Intelligence",https://ph-files.imgix.net/eb6e0309-7b11-4c8a-8f7d-02fc3250f30a.png?auto=format,296,6,2023-02-02T02:42:11Z,
377437,Peach,Create a following for your brand on WhatsApp,"Launch your newsletter & engage your customers on WhatsApp using beautiful, interactive content. First 100 signups will get FREE 3-month content calendar & templates, 30% off on all plans, free access to official API & dedicated customer success manager.",https://trypeach.io/,"Messaging,Newsletters,Marketing",https://ph-files.imgix.net/99db7b4e-6b7e-4ffb-84e5-cfab224ad1cb.jpeg?auto=format,294,45,2023-02-01T08:02:10Z,2023-02-01T08:02:10Z
377006,Internal All-in-One Platform,All-in-one platform for building internal tools,"With Internal’s all-in-one platform, you can connect databases and APIs to build internal tools including workflows, tasks, automations, and custom apps. We also released a GitHub integration so teams can control changes to apps across multiple environments.",https://www.internal.io/,"Productivity,SaaS,No-Code",https://ph-files.imgix.net/dca2b9fe-661a-46f5-a65a-3e7901ecfb21.gif?auto=format,259,34,2023-02-01T08:01:00Z,2023-02-01T08:01:00Z
377453,TailGrids 2.0,"Components, Blocks and Templates for Tailwind CSS","TailGrids is a handcrafted library of Tailwind CSS UI components, blocks, and templates. A vast collection of 500+ free & premium Tailwind UI components from various categories to make building frontend website UI easier by simply copying and pasting snippets.",https://tailgrids.com/,"Design Tools,Open Source,Developer Tools",https://ph-files.imgix.net/c2aa8b5e-0ff9-42ef-bd05-65220129f550.png?auto=format,228,51,2023-02-01T08:01:40Z,2023-02-01T08:01:40Z
377536,Flowly for Webflow,Host Webflow sites for half the price,"Flowly offers independent and affordable hosting for no-code platforms. It works by connecting or importing your Webflow site. When you edit your site or content in Webflow, changes are synced automatically to your custom domain hosted with Flowly.",https://flowly.website/,"Developer Tools,No-Code",https://ph-files.imgix.net/97717acb-6533-4e57-8b5a-f4a2e4545274.png?auto=format,224,45,2023-02-01T10:01:56Z,2023-02-01T10:01:56Z
377509,Brancher.ai,"Connect AI models to build AI apps in minutes, with no-code",Brancher.ai empowers you to connect generative AI models to make it super fast and easy to create apps - no coding necessary. The next generation of AI-powered apps will be built by you! Start creating today! - 🔌 https://www.brancher.ai,https://www.brancher.ai/,"Artificial Intelligence,Maker Tools,No-Code",https://ph-files.imgix.net/59dd537e-941d-4271-9c94-4d50c85c77c9.gif?auto=format,216,25,2023-02-01T08:02:00Z,2023-02-01T08:02:00Z
377473,ResumeCheck.net,Correct your resume with GPT3 AI-generated recommendations,"ResumeCheck.net is your gateway to GPT3 AI resume recommendation engine. With full audit, you will get access to General recommendations, Past experience corrections, Full grammar corrections, Personal skills adjustments and much more.",https://resumecheck.net,"Hiring,Productivity,Career",https://ph-files.imgix.net/c37a3c22-0e84-484b-b0a0-b55848ab3e93.png?auto=format,178,26,2023-02-01T08:48:30Z,2023-02-01T08:48:30Z
377480,OpenAI in Spreadsheet.com,The power of ChatGPT in spreadsheets,Generate content and answer questions about data in your spreadsheets with the same technology behind ChatGPT.,https://www.spreadsheet.com/integrations/openai,"Productivity,Spreadsheets,Artificial Intelligence",https://ph-files.imgix.net/b6dfa86c-1f0e-4bb0-93da-6db7f6417d43.png?auto=format,176,10,2023-02-01T08:01:00Z,2023-02-01T08:01:00Z
377557,SquirrelDisk,Fast and open source disk usage analysis tool,"The easiest open source app you will ever use to detect huge files. Built with Rust, Squirreldisk is the perfect alternative to software like WinDirStat, WizTree, TreeSize, and DaisyDisk. Supporting MacOS, Windows, and Linux.",https://github.com/adileo/squirreldisk,"Productivity,GitHub,Tech,Computers",https://ph-files.imgix.net/c130b962-cb76-45ac-a3a8-2d494a478304.png?auto=format,142,7,2023-02-01T15:19:48Z,2023-02-01T15:19:48Z
377484,RainbowKit,Add a wallet experience to your app,"RainbowKit provides a fast, easy and highly customizable way for developers to add a great wallet experience to their application. Designed for everyone. Built for developers.",https://www.rainbowkit.com/,"Developer Tools,GitHub,Web3,Ethereum",https://ph-files.imgix.net/e46945a6-6976-4602-948f-f18fd7fb659c.png?auto=format,133,10,2023-02-01T08:01:00Z,2023-02-01T08:01:00Z
377490,Buffer for Mastodon,Schedule posts to Mastodon,"Plan and schedule posts to Mastodon with Buffer's newest integration. Manage your hashtags, save content ideas, schedule posts at the optimal time, and cross-post to Twitter and your other favorite networks.",https://buffer.com/mastodon,"Productivity,Social Media,Social media marketing",https://ph-files.imgix.net/5f86e119-8e8d-4793-aba1-6243610790a8.gif?auto=format,126,23,2023-02-01T08:01:00Z,2023-02-01T08:01:00Z
375983,Water,Build custom ChatGPTs that run automations,"✍️ Customize ChatGPT's voice, knowledge, behavior to build your dream AI app. 🦾 Put ChatGPT to work. Connect with Airtable, Zapier, APIs and more. 💬 One-click to deploy a ChatGPT-like interface + share with friends and clients.",https://drinkwater.ai/,"Artificial Intelligence,No-Code",https://ph-files.imgix.net/8d351df4-dbbb-4aac-ae8e-c137503d3842.png?auto=format,124,15,2023-02-01T08:01:23Z,2023-02-01T08:01:23Z
377638,Nas.io,The platform for creators to build private communities,"Nas.io is the platform for creators to take back control of their community with exclusive memberships, courses, events, and more – all in one and all for free. Start your community today!",https://nas.io,"SaaS,Community",https://ph-files.imgix.net/f7c5ad4d-1f72-4ddf-bfdf-d417d1e7fafa.png?auto=format,1936,24,2023-02-02T08:02:00Z,
376759,Hyperquery,"Data notebook built for speed, visibility, and collaboration",Hyperquery is the data notebook for teams that enables you to easily build shareable analyses (in SQL or Python).,https://www.hyperquery.ai/,"Analytics,Data & Analytics,Data Science",https://ph-files.imgix.net/73995c33-43ee-4f5f-abb3-a9f4ed5b4b1b.gif?auto=format,1155,432,2023-02-02T10:03:51Z,2023-02-02T10:03:51Z
376738,Reverse Contact,Turn an email into a LinkedIn profile and +30 data points,Reverse Contact is a reverse email lookup tool that finds LinkedIn profiles & generates employee/company info from just an email address (even personal one). Optimize your data enrichment process with just a few clicks! https://app.reversecontact.com/register,https://www.reversecontact.com/,"Email,SaaS,LinkedIn,Data",https://ph-files.imgix.net/5380a196-ff44-4bf2-8313-f5a17ae27f65.png?auto=format,1115,141,2023-02-02T08:12:36Z,2023-02-02T08:12:36Z
377440,Figma to Webflow plugin,"Design websites in Figma, launch in Webflow",Convert and import your Figma designs to Webflow. The Webflow Figma plugin helps you transfer your Figma designs into production-ready Webflow HTML & CSS.,https://www.figma.com/community/plugin/1164923964214525039/Figma-to-Webflow-(HTML%2C-CSS-and-Website),"Design Tools,No-Code,Web Design",https://ph-files.imgix.net/f51a3650-19c8-4af6-98d4-d68c604c3c8e.jpeg?auto=format,957,60,2023-02-02T08:01:00Z,2023-02-02T08:01:00Z
375073,Litespace,A platform built to reconnect employees in hybrid workspace,Supercharge your hybrid workspaces by bringing your teams back into offices with more purpose while also giving them the flexibility of planning their own work week.,https://www.litespace.io/,"SaaS,Remote Work,Human Resources",https://ph-files.imgix.net/f46189e8-d0e1-4db5-9b4f-9449041a7620.gif?auto=format,827,254,2023-02-02T08:13:24Z,2023-02-02T08:13:24Z
377549,Evolup,Create your affiliate stores automatically with AI,"🔥 Create your affiliate stores in minutes with AI and turn your passions into profits! 🚀 Evolup combines speed, simplicity, and performance through its artificial intelligence, advanced SEO features, and full integration with Amazon's affiliate program... 💥",https://www.evolup.com,"Productivity,Artificial Intelligence,E-Commerce",https://ph-files.imgix.net/f688da4b-757a-4ee8-ad26-9cdc476b0e45.png?auto=format,560,62,2023-02-02T08:22:28Z,2023-02-02T08:22:28Z
377439,Minimal Theme for Twitter by Typefully,"Remove distractions, improve your Twitter experience","A huge update to the popular extension to remove distractions from Twitter and customize. Now with many new settings, Typefully integration, and finally available for Safari too. Join 30,000+ users and improve your Twitter experience.",https://typefully.com/minimal-twitter,"Chrome Extensions,Twitter,Social Networking",https://ph-files.imgix.net/a7c5d038-2bc1-4e71-af68-e712a0cee214.png?auto=format,407,34,2023-02-02T08:13:41Z,2023-02-02T08:13:41Z
377656,Memo 2.0,"Learn languages with videos, memes and fun","Memo takes language learning to a new level! 🚀 Imagine learning from real TikTok-style clips. You can instantly translate any word or sentence in the video. Upgrade skills and speak like a native, all in a fun, interactive way. 🔥 Try Memo now! 👀",https://www.memoapp.pro/,"iOS,Productivity,Languages",https://ph-files.imgix.net/7c52b0f4-1d03-4bc4-b2f6-4865875f7e67.gif?auto=format,318,94,2023-02-02T08:15:38Z,2023-02-02T08:15:38Z
377424,Go Holler,"One-question surveys, AI-powered insights","Create beautiful one-question surveys in seconds with Holler! Get AI-driven insights to quickly identify trends and patterns in your data (you can even import your external data). It’s Free, secure, and easy to collaborate on with your team.",https://goholler.ai/,"User Experience,Marketing,Artificial Intelligence",https://ph-files.imgix.net/1d4e2ee7-f8cd-483d-afce-d234fbd11b0b.png?auto=format,266,57,2023-02-02T08:01:00Z,2023-02-02T08:01:00Z
377659,AI Assist by airfocus,Unlock the power of AI for product managers,"Your PRD, problem statement, or new product idea is just a slash command away. Use AI to analyze feedback sentiment, simplify technical jargon, or write faster. It’s easy with airfocus AI Assist, a new super feature built into our product management platform.",https://airfocus.com/product/ai/,"Productivity,Artificial Intelligence,Tech",https://ph-files.imgix.net/657f1afb-03cf-478b-aca7-cc59e32cd0cd.png?auto=format,219,62,2023-02-02T08:15:26Z,2023-02-02T08:15:26Z
377673,Total.js Flow,Visual Programming Interface for everyone,Total.js Flow is an excellent and modern Visual Programming Interface for low-code development. It's a viable alternative to Node-RED and fully open-source under the MIT license.,https://www.totaljs.com/flow/,"API,Internet of Things,Developer Tools",https://ph-files.imgix.net/02ec7062-9216-41bd-b4ab-516d3120e544.png?auto=format,176,13,2023-02-02T15:55:22Z,2023-02-02T15:55:22Z
377639,Chat-GPT Growth Marketing Mastery Guide,Unleash your true marketing potential with AI,Get ahead of the curve and start your AI-powered marketing journey with CHAT-GPT! This marketing guide is packed with over 700+ prompts used to create this guide and 90+ resources to help you learn how to use Chat GPT for your personal brand or business.,https://kerryhue.gumroad.com/l/eqazs,"Marketing,Artificial Intelligence,Notion",https://ph-files.imgix.net/8a031c61-bd97-4d05-904a-18325abee5e9.png?auto=format,176,16,2023-02-02T08:55:42Z,2023-02-02T08:55:42Z
377596,Damus,The social network you control,"It's your very own Twitter for your friends or business. ⠀ Built on open internet protocols, there is no platform that can ban or censor you. You are in control of your data & speech.",https://damus.io/,"Twitter,Social Network,GitHub,Web3",https://ph-files.imgix.net/5fce7b6b-96ed-40f8-a356-8b81d2b20263.png?auto=format,158,19,2023-02-02T08:01:00Z,2023-02-02T08:01:00Z
377521,Algochurn,Ace your next front-end interview with confidence,Algochurn is a free platform that helps you ace your next front-end interview round with confidence. Algochurn provides quality front-end and algorithmic questions with an Integrated IDE to help you through your preparation journey.,https://www.algochurn.com/,"Productivity,Tech,Career",https://ph-files.imgix.net/9e1e23cb-6199-414b-b96c-28b4a4b0cce0.png?auto=format,154,40,2023-02-02T08:01:00Z,2023-02-02T08:01:00Z
377099,StillHiring.Today,Not a layoff tracker. See who the friggin' frig is hiring RN,"The community-sourced, no-pay-to-play, un-gated, BS-free, list of Tech Companies who are still ACTUALLY hiring right now. A @Corporate.Bro creation, Keyplay.io enriched. Sort by open roles, location, growth rates. Direct links to company job sites included.",https://stillhiring.today/,"Hiring,Tech,Tech news",https://ph-files.imgix.net/53cc4d96-939e-4118-b710-903a5a709409.png?auto=format,146,18,2023-02-02T14:01:00Z,
377092,CS job board,Talk directly with hiring managers & get 12x more interviews,The only job board that allows customer success professionals to skip the hiring queue and talk directly to the hiring manager. This results in 12x more interviews than the standard application process.,https://jobs.heybaton.com/,"Hiring,Customer Success,Career",https://ph-files.imgix.net/47b5bf1c-f310-4894-a38f-e51e031d225a.png?auto=format,131,37,2023-02-02T08:13:56Z,2023-02-02T08:13:56Z
377567,Owen Sans,"Spot the difference, but with fonts",Clear all 5 levels to beat this game. Turn your volume up. Just a silly game I made because I work with Open Sans and I was watching something starring Owen Wilson. Story here: https://twitter.com/_psiderman_/status/1574802967617671184,https://www.owensans.click/,"Typography,Funny Games,UX Design",https://ph-files.imgix.net/efdb3d2a-2c38-47c6-b95b-b26a2f94a844.png?auto=format,106,10,2023-02-02T08:01:00Z,2023-02-02T08:01:00Z
376898,Pedestal,Use periodization to maximize your fitness results,"Training for an event or just keeping fit, leave it to Pedestal to generate exercise plans customized for your fitness level and goals. You’ll know exactly what to do, when to do it, and for how long.",https://www.pedestal.fit,"Health & Fitness,Sports,Weightlifting",https://ph-files.imgix.net/ae979e81-f0e8-438d-9263-4443271af0b7.png?auto=format,104,39,2023-02-02T08:01:00Z,2023-02-02T08:01:00Z
377583,Mia,A new personal assistant built on ChatGPT,"I'm Mia, I use ChatGPT to assist you with a wide range of tasks, such as answering questions, providing information, and even engaging in conversation. I am here to help you.",https://play.google.com/store/apps/details,"Android,Messaging,Artificial Intelligence,Bots",https://ph-files.imgix.net/3708b0d4-76d1-4ecd-afc7-be5e2de72674.png?auto=format,101,14,2023-02-02T08:01:00Z,2023-02-02T08:01:00Z
377680,Planner 5D aka Lensa for Interior Design,Snap a photo and generate new design ideas with your iPhone,"Generate unlimited design ideas with a tap of a button. Upload your photo, wait a few moments, and get inspiration for your next design project.",https://apps.apple.com/app/planner-5d-interior-desig-n/id606173978,"Design Tools,Artificial Intelligence,Interior design",https://ph-files.imgix.net/a02115b1-a9db-4213-877a-f728c2301671.gif?auto=format,91,32,2023-02-02T09:13:00Z,
377582,No-Code Exits,Real stories of people making money with no-code,Learn from real stories of profitable or acquired products made without code. Join 4000+ subscribers now and receive every Thursday a bite-sized interview.,https://www.nocode-exits.com/,"Side Project,No-Code,Business",https://ph-files.imgix.net/69a8516a-ff68-40c0-b03e-bae9c8833445.png?auto=format,797,267,2023-02-03T08:07:18Z,2023-02-03T08:07:18Z
377818,Hiring Copilot,Find any email & personalise outbound sequences with GPT3,Use Hiring Copilot to find 📨personal email address of any LinkedIn; 🖱️Send email drip sequence with just 1 click; 🤖Personalise messages via GPT3; 💫Automatically send LinkedIn message & emails in same sequence; and 📝Manage via realtime synced Google Sheet,https://www.weekday.works/hiring-copilot,"Chrome Extensions,Email,Productivity",https://ph-files.imgix.net/c914c3ea-47a0-408d-98b5-dca6f2ac8cbf.jpeg?auto=format,713,168,2023-02-03T08:01:00Z,2023-02-03T08:01:00Z
377741,iVisa Plus,Simplifying travel around the world,"At iVisa, we manage the rules and regulations required for travel. The iVisa Plus subscription offers Individual or Family Plans allowing you to enjoy a flat rate annual fee for unlimited visa services. Billed annually, cancel anytime.",https://www.ivisa.com/plus,"Global Nomad,Travel,Vacation",https://ph-files.imgix.net/1b1c2957-9ef2-4a44-ba7c-4766758e5a48.png?auto=format,578,87,2023-02-03T08:18:36Z,2023-02-03T08:18:36Z
377297,ZooTools Panda,"Launch waitlists, referrals, and gamified competitions","ZooTools Panda is the easiest way to collect leads and build your audience. Create viral waitlists, gamified competitions, referral programs and more. Join 7,000+ happy marketers.",https://zootools.co/referral-marketing,"Email Marketing,Marketing,Growth Hacking,Growth Hacks ,Marketing automation,Influencer marketing,Event marketing,Affiliate marketing",https://ph-files.imgix.net/c459ecc7-e928-45be-ba49-770636341d26.png?auto=format,484,150,2023-02-03T08:01:00Z,2023-02-03T08:01:00Z
377829,Free PFP Maker,Create a stunning profile picture with just a few clicks,"Get ready to stand out on social media with our free pfp maker! Simply upload your favorite photo and let our tool do the work for you. With just a few clicks, you'll have access to hundreds of unique and customized profile pictures to choose from.",https://www.profilepicture.ai/free-pfp-maker,"Social Media,Photography",https://ph-files.imgix.net/0143505d-0991-4aae-9bc2-04f3d05405e0.png?auto=format,283,50,2023-02-03T08:01:00Z,2023-02-03T08:01:00Z
377641,GoProd for Mac,Remove backgrounds and upscale lots of pics in 1 click,"Two-in-one background remover and image upscaler to handle unlimited batches of product images, portraits, or other photos. Drop your pics into the app and get the results in a few seconds. Skip the routine. Delegate it to AI.",https://icons8.com/goprod,"Design Tools,Marketing,Photography",https://ph-files.imgix.net/76713785-82da-425f-b87c-32441542c830.png?auto=format,266,44,2023-02-03T11:19:35Z,2023-02-03T11:19:35Z
377230,ChatGPT Search Planner,Organize and archive your ChatGPT prompts and searches,"The Ultimate Search Planner to organize and streamline ChatGPT searches, prompts and resources in one place, digitally.",https://pascio.gumroad.com/l/searchplanner,"Artificial Intelligence,Notion",https://ph-files.imgix.net/f201758e-c5b8-4ffc-b6ad-b2de0321c90f.gif?auto=format,255,28,2023-02-03T08:12:25Z,2023-02-03T08:12:25Z
377774,SEO Stan,An AI-powered micro SEO tool for bloggers and makers,"An AI powered SEO tool for busy bloggers, indie-hackers, and makers who've finalized their niche keywords. You can use SEO Stan to quickly generate blog post ideas, search-friendly article titles, meta descriptions, URL slugs, etc.",https://m64.in/seo-stan/,Artificial Intelligence,https://ph-files.imgix.net/24969436-86ce-47e1-a96e-e716273d98d0.gif?auto=format,144,23,2023-02-03T08:01:00Z,2023-02-03T08:01:00Z
377817,Days Counter Event Tracker,Don't forget a single important date,"Days Counter is a free, straightforward tool to track key events and count down to important milestones. It includes a record of past events, smart reminders, count up and down modes, a dark theme, a widget, and customizable interface.",https://apps.apple.com/lt/app/days-calculator-event-tracker/id1604856248,"Productivity,Events",https://ph-files.imgix.net/34723898-0f85-4c99-a6bc-b3ff9af70ee7.png?auto=format,126,47,2023-02-03T08:01:00Z,2023-02-03T08:01:00Z
377841,Notion Typed,Convert Notion pages to beautiful PDFs,"Notion Typed is a web based tool for converting Notion pages to PDF documents. Although the official Notion app features similar export functionality, Notion Typed brings additional features, making your Notion pages more attractive to read on screen and on paper.",https://notiontyped.com,Notion,https://ph-files.imgix.net/d9f39b98-6148-4fe9-853d-d5d9dec30339.png?auto=format,114,5,2023-02-03T08:08:44Z,2023-02-03T08:08:44Z
377771,Halist Browser AI,Augment your browsing & intellect,"Use Halist AI to get answers, respond to Gmail emails, write for you and create summaries — all from a browser extension.",https://halist.ai/,"Chrome Extensions,Email,Productivity,Writing",https://ph-files.imgix.net/ead16c24-6d3c-43ad-9d87-17db15f20e54.png?auto=format,104,16,2023-02-03T08:01:00Z,2023-02-03T08:01:00Z
377600,Playarti,Create art in a click,"Arti is a point-and-click AI art generator for families! All you have to do is pick a place, activity, and animal, and PlayArti will take care of the rest! The possibilities are endless and the results are always surprising and adorable!",https://www.playarti.com,"Art,Kids,Artificial Intelligence",https://ph-files.imgix.net/497aa3ee-810d-40ab-85a3-eb3a8f4aa9d6.png?auto=format,103,20,2023-02-03T08:07:44Z,2023-02-03T08:07:44Z
377847,Color Pop AI,World’s first AI coloring pages generator,"With Color Pop, you can enjoy a highly realistic coloring experience from the convenience of your device. Its AI feature allows you to easily generate canvas images straight from your imagination. Color and showcase it to the Color Pop community!",https://apps.apple.com/us/app/color-pop-coloring-games/id1517805311,"Android,Social Network,Artificial Intelligence,Coloring",https://ph-files.imgix.net/00d1116a-4a8b-4f93-8963-11ee4b6a45ab.gif?auto=format,87,21,2023-02-03T09:11:40Z,2023-02-03T09:11:40Z
377780,AI Ghostwriter,Wordpress ChatGPT Plugin,"Unleash the power of AI in content creation with AI Ghostwriter - the intelligent WordPress plugin that generates high-quality content, powered by ChatGPT.",https://www.ai-ghostwriter.com/,Artificial Intelligence,https://ph-files.imgix.net/783d3802-5a19-4af0-8ed3-c62f29e52c56.png?auto=format,70,11,2023-02-03T08:01:00Z,2023-02-03T08:01:00Z
