id,name,tagline,desc,website,category,thumbnail,votes,comments,createdAt,launchedAt
379657,Outerbase,The interface for your database,"Outerbase is an easy way to manage your data on Postgres, MySQL, and other relational databases. Using SQL or EZQL, our GPT-3 based plain text to SQL generator, users can come in and easily edit, view, query, and visualize their data all in one place.",https://outerbase.com,"Analytics,Developer Tools,Artificial Intelligence",https://ph-files.imgix.net/2a1b14b0-2170-4ead-ba2a-89b1c0120c36.gif?auto=format,645,45,2023-02-15T08:01:00Z,2023-02-15T08:01:00Z
378936,ChatGPT eCommerce Prompts,2M+ prompts for all your eCommerce marketing requirements,"With 2M+ ChatGPT prompts, get a jump-start on your marketing initiatives. Create compelling page headlines, descriptions & marketing messages that drive traffic, build engagement, & boost sales! The best part? It's free! Set up your eCom strategies in a jiffy.",https://www.ecommerceprompts.com/,"Productivity,Marketing,Artificial Intelligence,E-Commerce",https://ph-files.imgix.net/882206b3-74cc-4f03-8e09-333a14a2f2b6.gif?auto=format,549,100,2023-02-15T08:05:42Z,2023-02-15T08:05:42Z
379453,$1 Delaware Franchise Tax by Fondo,Let Fondo file your Delaware Franchise Tax for $1,"All Delaware Corporations are legally required to file Delaware Franchise Tax each year. The tax is due on March 1, 2023 (in 13 days). Let Fondo prepare and file for your startup for $1.",https://www.tryfondo.com/1,"Fintech,Money,Accounting",https://ph-files.imgix.net/0c14a799-5f77-4f75-bfe3-58c5aba7bb28.gif?auto=format,543,63,2023-02-15T08:01:00Z,2023-02-15T08:01:00Z
378528,Faros Essentials,Get Git and Jira analytics in under 10 minutes,"Get Git & Jira analytics in under 10 minutes with Faros Essentials. Make data-driven decisions on software projects with insights into PR cycle times, code review bottlenecks, unplanned work, and more! Faros Essentials is free, open-source + runs on any laptop",https://www.faros.ai/git-jira-analytics-in-10-minutes,"Analytics,Software Engineering,Developer Tools",https://ph-files.imgix.net/860446ca-9d20-4ef4-be12-e5585a8cba66.png?auto=format,452,56,2023-02-15T08:01:00Z,2023-02-15T08:01:00Z
379625,Voidpet,A self care app where you collect monsters based on emotions,"Descend into the void, and befriend mysterious creatures that spawn from your emotions. Nurture your oasis through mindfulness and self care. Collect all of the rare species that visit your garden of consciousness!",https://voidpet.com,"Android,iOS,Health & Fitness",https://ph-files.imgix.net/24203958-2d54-4cc2-8c83-a9549d4e8fe8.png?auto=format,443,30,2023-02-15T08:50:50Z,2023-02-15T08:50:50Z
378697,writeGPT,Become Superhuman with everyday tasks by harnessing ChatGPT,"writeGPT is designed to overcome unproductive browsing habits by plugging ChatGPT capabilities on any website & search engine while facilitating effective prompt engineering to read, write, rewrite, reply to emails, code & research any content.",https://chrome.google.com/webstore/detail/writegpt-chatgpt-prompt-e/dflcdbibjghipieemcligeelbmackgco,"Productivity,Marketing,Artificial Intelligence",https://ph-files.imgix.net/fb25e43e-1fc2-425c-a6af-9071ad1209ee.png?auto=format,363,95,2023-02-15T08:00:00Z,2023-02-15T08:00:00Z
379355,Universal Inbox,Service your customers across multiple channels,"Helpwise's Universal Inbox lets you manage customer queries from multiple channels (e.g. email, voice, chat, SMS, social media) in one place, collaborate with team members, use analytics, automate workflows to reduce workload and improve efficiency.",https://app.helpwise.io/producthunt,"Email,Messaging,Customer Communication",https://ph-files.imgix.net/07be5175-afd5-4b82-be04-929a4a529707.png?auto=format,250,80,2023-02-15T08:02:00Z,2023-02-15T08:02:00Z
379628,Video Scripts for Sales,Create sales videos that convert with Sendspark's AI tool,"Know you should use video for sales outreach, but not sure what to say? We built a free tool with OpenAI to help you instantly create video scripts!",https://sendspark.com/video-script-generator,"Sales,Artificial Intelligence,Video",https://ph-files.imgix.net/43f867fe-9f70-46db-92bf-c8db664b51c5.gif?auto=format,242,54,2023-02-15T09:26:19Z,2023-02-15T09:26:19Z
379668,Inkle,Chat-based accountant for US companies,"US tax compliance for founders is complicated! It's even harder when you live abroad. Inkle helps founders to access affordable, licensed CPAs and bookkeepers, and manage filings from anywhere with asynchronous human chat.",https://www.inkle.io/,"Fintech,SaaS,Accounting",https://ph-files.imgix.net/1cd10ae0-ad75-4ac1-8e1b-cf66ad86d891.gif?auto=format,235,65,2023-02-15T09:29:54Z,2023-02-15T09:29:54Z
379659,3D illustrations,"Over 141,000 customizable 3D illustrations","Make your designs stand out with one of the most extensive 3D illustration libraries on the planet: over 141,000 highly customizable 3D assets and their source files. View assets in 360°, edit colors, download in a file format of your choice, and ship.",https://iconscout.com/3ds,"Design Tools,Graphics & Design,3D Modeling",https://ph-files.imgix.net/5d2dd4c2-a7f5-4500-a723-6d6107f2ff1c.gif?auto=format,204,49,2023-02-15T08:01:00Z,2023-02-15T08:01:00Z
377298,Workplan,Task management that sucks less,"Introducing Workplan, the task management solution that allows you to easily and efficiently manage your project by visualizing resource allocation, collaborating with team members in real-time, and managing sub-tasks all for the cost of a cappuccino.",https://getworkplan.io/,"Productivity,Task Management",https://ph-files.imgix.net/bdd82ab9-e27c-408d-b5a3-d1aab5650dac.png?auto=format,189,40,2023-02-15T08:01:00Z,2023-02-15T08:01:00Z
378726,Autoproof for Startups,"Automatic code copyright protection, secure startup's future","Secure your startup's future, wow investors, and have no legal battles. Once connected to your development process, Autoproof automatically protects the codebase copyright. 320 times cheaper than attorney costs, and it works from the day you start.",https://autoproof.dev/,"Legal,Developer Tools,Startup Lessons,Web3,Blockchain,Fundraising",https://ph-files.imgix.net/5574dbe3-0a9d-4ccd-b996-b8242b19b0ac.gif?auto=format,172,60,2023-02-15T08:01:00Z,2023-02-15T08:01:00Z
379550,Rerun,Visualize computer vision,Rerun is an SDK for logging computer vision and robotics data paired with a visualizer for exploring that data over time. It lets you debug and understand the internal state and data of your systems with minimal code. It’s built in Rust to run fast everywhere.,https://www.rerun.io/,"Design Tools,Open Source,Developer Tools",https://ph-files.imgix.net/e1d398ad-fff4-478e-98f1-13e0571a6325.gif?auto=format,166,55,2023-02-15T08:01:00Z,2023-02-15T08:01:00Z
379523,Pixlr 2023 AI-Powered Editor,"Revolutionize your designs with the power of AI, today",✨ Smart resize in just ONE-GO ✨ Easily generate AI-Images via text prompts ✨ Magically montage with AI Infill ✨ Create cool text layouts with Text Wrap ✨ Color-correct like a PRO ✨ Dive into diverse color tones efficiently ✨ And many more...,https://pixlr.com/suite/,"Design Tools,Photography,Artificial Intelligence",https://ph-files.imgix.net/a1d39ef1-e934-43a9-9e01-36ba366b6d06.gif?auto=format,126,52,2023-02-15T08:01:00Z,2023-02-15T08:01:00Z
379602,Disposable,"A real-time, e2e encrypted ephemeral communication tool","A real-time, e2e encrypted ephemeral communication tool for secret, sensitive conversations. Chats disappear as they are read and no data is stored or retained.",https://disposablebase.com,"Messaging,Privacy,Developer Tools",https://ph-files.imgix.net/f57588d3-4412-4b86-be3d-0eae347ce9e5.png?auto=format,109,30,2023-02-15T08:01:00Z,2023-02-15T08:01:00Z
379760,Patterns,Connect AI like ChatGPT to real business actions,"Patterns is the fastest way to connect AI like ChatGPT to real business data and drive actions. In Patterns, you can build a Slack bot to answer incoming customer questions using your existing docs, add an AI assist feature to your product, and more.",https://www.patterns.app/,"Developer Tools,Artificial Intelligence,Data",https://ph-files.imgix.net/ec5056f0-9aa6-490e-9b5c-2ea2348afbd4.gif?auto=format,1028,84,2023-02-16T08:01:00Z,2023-02-16T08:01:00Z
376978,Dispatch,Priority inbox for Slack,"Do you spend hours a day in Slack? With Dispatch priority inbox you can... ✔ Stop missing messages ✔ Focus on your top priorities ✔ Prioritize messages based on sender, channel, message content, and more",https://www.dispatch.do/,"Slack,Productivity,SaaS",https://ph-files.imgix.net/a3837ad0-2105-4911-8ad3-8ced89779710.gif?auto=format,712,175,2023-02-16T08:01:00Z,2023-02-16T08:01:00Z
379739,10Web AI Assistant for WordPress,Generate SEO-optimized content 10X faster with AI,"Leverage the power of AI to write and perfect SEO-optimized content, without leaving your Gutenberg or Classic Editor.",https://10web.io/ai-writing-assistant/,"Writing,SEO,WordPress",https://ph-files.imgix.net/1ca1ea1c-f6ca-47d3-9deb-62c2ebdb4888.gif?auto=format,560,142,2023-02-16T08:01:00Z,2023-02-16T08:01:00Z
379765,Shardible,A low code end to end NFT marketplace,"Shardible Is a low code end-to-end NFT marketplace built on Shardeum that provides comprehensive support for all your NFT needs. Whether you're a collector, artist, or developer.",https://shardible.io/,"Art,Web3,NFT",https://ph-files.imgix.net/cf1aa050-b5ac-40ab-a832-3eba627db17c.png?auto=format,525,17,2023-02-16T08:01:00Z,2023-02-16T08:01:00Z
379868,DevAssist Extension (by ChainGPT),Never sign a Web3 transaction you don't understand again.,"DevAssist helps Web3 users understand the smart-contract they are interacting with better. It analyzes & translates the code behind the contract into plain English. Helping users understand the transaction they are committing to, better.",https://www.chaingpt.org/devassist,"Artificial Intelligence,Web3,Blockchain",https://ph-files.imgix.net/8c2c118b-ba51-4c4b-b005-d606883159f5.png?auto=format,351,28,2023-02-16T09:40:17Z,
379839,MojoAuth 3.0 AI,Enhance existing authentication or setup a new login page,Eliminate the development efforts by integrating MojoAuth login pages in seconds without coding or compromising your existing authentication flow for users to get comfortable with more secure password free options. Say goodbye to passwords!,https://mojoauth.com/,"API,Developer Tools,Security",https://ph-files.imgix.net/bfda31d5-4bd7-446d-9efb-0df245d62035.gif?auto=format,271,75,2023-02-16T08:11:21Z,2023-02-16T08:11:21Z
379390,Duffel Links,The fastest way to sell flights online,"Use Duffel Links to sell flights online fast. In 3 simple steps through one single API request, offer your customers a best-in-class shopping experience tailored to your brand.",https://duffel.com/links,"Travel,Tech,Business Travel",https://ph-files.imgix.net/2cddece9-42f8-404b-99fe-6a9c6bfca23c.jpeg?auto=format,239,60,2023-02-16T08:01:00Z,2023-02-16T08:01:00Z
379727,Buffer's AI Assistant,Create more with the Buffer AI assistant,"With the Buffer AI Assistant you can generate ideas in just a click and repurpose your existing content into dozens of creative variations, helping you grow your engagement across all social platforms.",https://buffer.com/ai-assistant,"Social Media,Marketing,Artificial Intelligence",https://ph-files.imgix.net/d239922a-d359-4d2a-aadc-9491bba6a334.gif?auto=format,228,18,2023-02-16T08:00:00Z,2023-02-16T08:00:00Z
379848,Hear It Fresh,Listen to new music that's right for you,Discover new tracks with Hear It Fresh! This user-friendly web app generates personalized Spotify playlists based on your favourite artists or a Spotify playlist link. Keep your playlist fresh and stay on top of your music game - try it now!,https://Hearitfresh.vercel.app,"Music,Spotify,Side Project,Entertainment",https://ph-files.imgix.net/dc402cce-dd04-426f-b3dc-d2e945f4f4dc.png?auto=format,197,111,2023-02-16T08:07:41Z,2023-02-16T08:07:41Z
378635,BugProve,Product security for IoT products with advanced code check,"Security engineers can upload the firmware that runs on the IoT device, and the tool will check for both known and zero-day vulnerabilities in the code. Doing several days of work in less than an hour, product security can be accessible for all manufacturers",https://bugprove.com/,"Internet of Things,Developer Tools,Security",https://ph-files.imgix.net/eb10cfce-e748-41c3-b2c9-dbc705693209.png?auto=format,164,25,2023-02-16T08:26:05Z,2023-02-16T08:26:05Z
379847,Product-Market Fit Survey by Formbricks,Open source micro-survey tool for B2B SaaS,Always know how your users perceive your product. Gather actionable user insights with highly specific in-app surveys. Find PMF faster. Formbricks is an open source micro-survey tool for B2B SaaS.,https://formbricks.com/,"User Experience,SaaS,Developer Tools",https://ph-files.imgix.net/1b030faf-54e2-44d2-b7c8-f9213aed7f18.png?auto=format,153,62,2023-02-16T08:11:14Z,2023-02-16T08:11:14Z
379159,Billie,Supercharge your invoice archive flow on macOS,"Stop wasting time renaming & moving invoices on your system. Through the power of machine learning and a little touch of magic, Billie is your personal invoice assistant on macOS. It will automatically rename & move your files, or mail it to your accountant.",https://getbillie.app,"Productivity,Menu Bar Apps,Finance",https://ph-files.imgix.net/7581e462-da6d-4947-a992-90ff887d62de.png?auto=format,150,37,2023-02-16T08:08:18Z,2023-02-16T08:08:18Z
379611,LeadIQ Scribe,Generate personalized sales emails in seconds,"LeadIQ Scribe is our patented AI email writer built specifically for sellers. Using your value props, Scribe can generate tailored, complete sales messages that get replies. Arrest your buyer’s attention with personalized, tailored outreach at scale.",https://leadiq.com/scribe,"Email,Sales,Artificial Intelligence",https://ph-files.imgix.net/6f48317a-4cef-47d6-82fa-d89e68cc6688.png?auto=format,143,55,2023-02-16T08:08:25Z,2023-02-16T08:08:25Z
379831,Dime 2.0,"Modern, intuitive expense tracking and budgeting","Dime 2.0 is here with income tracking, overall budgets, a UI makeover and more! It is a beautiful, intuitive expense tracker built with iOS design guidelines in mind. And, it's 100% free with no ads or paywalls.",https://apps.apple.com/app/id1635280255,"iOS,Money,Personal Finance",https://ph-files.imgix.net/f1b04d68-f203-47d9-8bdd-6a97842209d6.png?auto=format,121,15,2023-02-16T08:10:11Z,2023-02-16T08:10:11Z
379919,4Privacy,"Life’s essential information, organized & always in reach","4Privacy helps organize life’s essential information so you’re never caught off guard. From ID cards and tax documents to estate plans and property info, your stuff is secure, private, and always at your fingertips.",https://4privacy.com/,"Productivity,Storage,Privacy",https://ph-files.imgix.net/545bd2a8-377d-49e2-8503-19bdefbf66d9.gif?auto=format,115,7,2023-02-16T15:03:18Z,2023-02-16T15:03:18Z
379600,Codecademy Pro,Reach your career goals with new Pro features,"Get job-ready with new and improved features on Codecademy Pro. Practice for technical interviews, connect with employers, and pass exams to get a Codecademy professional certification you can add to your resume.",https://try.codecademy.com/all-new-pro,"Education,Tech,Online Learning",https://ph-files.imgix.net/59843859-8ccd-4c37-8e62-e30bc0bd9ae2.png?auto=format,111,17,2023-02-16T08:01:00Z,2023-02-16T08:01:00Z
379731,Hush Privacy AI,Uncover everything the web knows and remove what is private,Hush is a premium privacy service powered by smart AI. Our AI frequently scans the web for your personal information and alerts you to any sensitive information. Hush removes high-risk items with the click of a button - putting you in control of your digital privacy.,https://ai.gohush.com/,"SaaS,Privacy,Artificial Intelligence",https://ph-files.imgix.net/34324d7e-27ed-44a4-b96b-3dd90e09e61f.gif?auto=format,108,32,2023-02-16T08:01:00Z,2023-02-16T08:01:00Z
378653,IntentBot,Identify accounts showing intent in 3-clicks,IntentBot lets you search for accounts showing intent in real-time. Enter a domain and a topic to see who’s showing intent towards you or companies you’re curious about. The best part? It’s ungated and free so you can try intent on your own terms.,https://foundryco.com/our-solutions/intentbot/,"Sales,Marketing,Data Visualization",https://ph-files.imgix.net/1fee4cad-e262-4c00-baa8-8b693a7611ca.gif?auto=format,98,29,2023-02-16T08:09:45Z,2023-02-16T08:09:45Z
379478,Visulry,Unlimited UI/UX design to scale your startup,"Visulry is a productized service for unlimited UI/UX design with Figma. Simply sign up for a plan and request all the design help you need. Get a design update within a few days, and request revisions until you are completely satisfied.",https://www.visulry.com/,"Design Tools,User Experience,Design",https://ph-files.imgix.net/48773160-ba9f-4e2b-99f3-d2c027df7e84.png?auto=format,89,18,2023-02-16T08:01:00Z,2023-02-16T08:01:00Z
379769,Movydick: And The Oscar Goes To...,Make your vote and predict the winners of the next Oscars,"Fun game of votes where you can make a vote for actors, actresses, directors, movies and predict the winners for the next Oscar Awards.",https://movydick.vercel.app/academy-awards-winners-predictions-2023,"Movies,Side Project,Entertainment",https://ph-files.imgix.net/29b5d972-b413-41ed-82fb-8d68de83c820.png?auto=format,80,74,2023-02-16T08:09:02Z,2023-02-16T08:09:02Z
379806,IngestAI,Build ChatGPT bots on Slack/Discord answering on your docs,"Hey Everybody 👋 We are super stoked to announce the launch of IngestAI today 🥳 It is the fastest way to build ChatGPT-like bots within your own WhatsApp, Slack, or Discord to answer queries from your knowledge base, documentation, or educational materials.",https://ingestai.io,"Slack,Customer Communication,Artificial Intelligence",https://ph-files.imgix.net/05fd62b6-41b5-4673-986b-d6e8c07f1dfd.png?auto=format,822,100,2023-02-17T08:01:00Z,2023-02-17T08:01:00Z
376598,SamurAI,Automate community building on discord with ChatGPT,"SamurAI is community chatbot powered by ChatGPT to create, manage and grow your community on Discord with an ability to create servers, channel, manage invite, welcome users and answer queries.",https://app.thesamur.ai/chat,Artificial Intelligence,https://ph-files.imgix.net/c7770c94-179e-49ad-8847-2376aef20e4f.gif?auto=format,676,631,2023-02-17T08:01:00Z,2023-02-17T08:01:00Z
379016,Video Landing Pages by Gander,Capture attention & convert shoppers with Gander,"Before capturing the hearts and minds of consumers, you have to capture their attention. Gander enables brands to spin up high-converting, attention-grabbing, video UGC pages with just a few lines of code.",https://www.gogander.io/how-it-works/landing-pages,"Social Media,Marketing,E-Commerce",https://ph-files.imgix.net/23474a93-5517-4d24-ba24-3f49280ee87c.gif?auto=format,390,128,2023-02-17T08:10:14Z,2023-02-17T08:10:14Z
380018,Product Hunt Success Playbook,Proven tactics & tools to boost your PH launch,"Drive support and get upvotes for your Product Hunt launch with our all-in-one collection of planning checklists, launch guides, tools, exclusive community and insider maps. Built by a team who has done more than 20 PH launches (10+ featured) till now.",https://www.mailmodo.com/product-hunt-launch/get/,Product Hunt,https://ph-files.imgix.net/42f131c4-6c65-4c71-b730-037d95b4c239.gif?auto=format,340,90,2023-02-17T08:09:18Z,2023-02-17T08:09:18Z
379991,MarioGPT,Generate endless Super Mario levels for free with GPT,"MarioGPT is a finetuned GPT2 model that is able to generate Super Mario levels from a simple text prompt. This generation is not perfect, but is a great first step more controllable and diverse level / environment generation! 🍄",https://github.com/shyamsn97/mario-gpt,"Open Source,Artificial Intelligence,GitHub,Games",https://ph-files.imgix.net/60b2b193-ae91-4746-8e15-e16fced4b608.gif?auto=format,272,33,2023-02-17T08:01:00Z,2023-02-17T08:01:00Z
380026,HEDWiG,"GPT-powered, custom recruitment email generator",HEDWiG is a simple tool that assists recruiters in crafting effective and custom emails to potential candidates. Say goodbye to generic templates and hello to efficient and effective recruitment communication with HEDWiG.,https://www.springworks.in/albus/,"Email,Hiring,Artificial Intelligence",https://ph-files.imgix.net/144da2e0-151e-4b24-93c0-d650a77de4f6.png?auto=format,263,31,2023-02-17T08:03:45Z,2023-02-17T08:03:45Z
378904,StudentHub+ for Notion,Free Notion template for students,"StudentHub+ is a free Notion template for students that lets you organize your calendar, your to-dos, and your classes, all in one place. This template teaches you how to use advanced Notion features like databases, relations, widgets, and iOS shortcuts.",https://danatplus.gumroad.com/l/studenthub,"Education,Calendar,Notion",https://ph-files.imgix.net/b06b9434-b609-481b-b717-f61626883863.png?auto=format,257,68,2023-02-17T08:11:38Z,2023-02-17T08:11:38Z
379977,ScreenRun ,beautiful videos from screenshots or recordings in seconds,"Create beautiful videos from a simple screenshot or screen recording with a few clicks, add a music track and share on social media or work messaging like Slack as mp4.",https://ScreenRun.app,"Social Media,Meetings,Photo & Video",https://ph-files.imgix.net/91b97b06-b519-41ed-b98a-2749d733a07a.png?auto=format,241,46,2023-02-17T08:30:00Z,2023-02-17T08:30:00Z
379887,Snowball Analytics,Powerful portfolio tracker for modern investors,"Snowball is a powerful portfolio tracker made for modern investors 💰 Track all investments in one place - stocks, funds, crypto, custom investments 🌐 Made for investors everywhere - multiple exchanges and currencies 🤓 Beautiful and powerful analytics",https://snowball-analytics.com/,"Fintech,Investing,Personal Finance",https://ph-files.imgix.net/7053838c-5f49-4a4c-88ca-5b62e9066207.gif?auto=format,225,90,2023-02-17T08:10:01Z,2023-02-17T08:10:01Z
379963,Replit's Ghostwriter Chat,The first conversational AI built right into your IDE,"Ghostwriter Chat is the first conversational AI built right in your IDE, complete with a proactive Debugger. It has intelligent project context, so it can provide solutions unique to your project.",https://replit.com/site/ghostwriter,"Productivity,Developer Tools,Artificial Intelligence",https://ph-files.imgix.net/b953df9a-9a36-4ec1-944e-76dfd071dc3b.gif?auto=format,155,9,2023-02-17T08:01:00Z,2023-02-17T08:01:00Z
380028,Headshot AI,The perfect AI-generated LinkedIn headshots,"Create the perfect LinkedIn headshots Headshot AI uses AI to creates a strong, positive first impression. Upload 10 to 15 photos of yourself and get up to 100 professional headshots in different styles. Get 14X more visits & 36X more messages on LinkedIn",https://figmill.com,"Design Tools,Photography,Artificial Intelligence",https://ph-files.imgix.net/e9d03aa6-6007-41cb-a139-1288877424ef.gif?auto=format,131,20,2023-02-17T08:08:45Z,2023-02-17T08:08:45Z
380073,dyrector.io,A self-hosted container management platform,dyrectorio is an open-source container management platform that offers self-service Docker and Kubernetes deployment and configuration management capabilities to any cloud or on-premises infrastructure for developers with an intuitive UI.,https://app.dyrectorio.com/auth/login,"Open Source,Software Engineering,Developer Tools",https://ph-files.imgix.net/d24ad160-a270-4c1c-a2ff-99afdb457508.jpeg?auto=format,124,21,2023-02-17T14:51:18Z,2023-02-17T14:51:18Z
379911,Article Idea Generator,Bring your writing to life with article idea generator,"The Article Idea Generator is an open-source tool powered by AI technology designed to help writers overcome the frustration of writer's block. Whether you're a seasoned writer or just starting, it's the perfect solution for generating new article ideas.",https://www.articleideagenerator.com/,"Open Source,Writing,GitHub,Tech",https://ph-files.imgix.net/d3ea1e0e-1b9d-4c47-92a1-693a95a65e13.png?auto=format,101,27,2023-02-17T08:01:00Z,2023-02-17T08:01:00Z
379943,GitLab Integration Marketplace,Improve your engineering processes with GitLab Apps,Discover the best GitLab integrations for your workflow with GitLabIntegrations.com! Our comprehensive platform features over 40 integrations and 11 categories to help you find the tools you need for improved productivity and faster value delivery.,https://developerintegrations.com/,"Productivity,Software Engineering,Developer Tools",https://ph-files.imgix.net/57174eb2-bb86-486a-bd47-355f82019dae.png?auto=format,92,13,2023-02-17T08:24:02Z,2023-02-17T08:24:02Z
379928,Replacing You,It’s time to reimagine the way you work,"AI won't replace you. Someone using AI will. Join a community of next-gen creatives using AI to take their work to the next level. Discover and explore the latest AI-enabled tools for creatives. Tools are added daily with weekly emails, guides, and more.",https://www.replacingyou.com,"Design Tools,Productivity,Artificial Intelligence",https://ph-files.imgix.net/a6275526-3169-471c-bcfb-b4b87ba64a74.gif?auto=format,84,11,2023-02-17T08:11:54Z,2023-02-17T08:11:54Z
380024,Blog Design Ideas,"Unleash your blog's full potential, 100+ inspirational ideas","Don't know where to start on blog appearance? Well, don't worry! We've curated more than a hundred blog design ideas to get you on the right way.",https://blogdesignideas.com/,"User Experience,SaaS,Tech",https://ph-files.imgix.net/ccf9f18e-9630-414e-8b00-8964e4f32c97.gif?auto=format,80,12,2023-02-17T08:12:53Z,2023-02-17T08:12:53Z
