id,name,tagline,desc,website,category,thumbnail,votes,comments,createdAt,launchedAt
378189,Not By Email,Send sensitive info without the risk of email & text msgs,"Secure Messaging Platform HIPPA, SOX, & PCS compliant Securely send passwords, banking info, SSNs, medical records and more without email and text messages Bank-level ID verification technology ensures messages are genuine",https://notbyemail.com,"SaaS,Business,Security",https://ph-files.imgix.net/67d6f974-a6a2-4b1a-b62f-6ac5315f23ef.jpeg?auto=format,70,9,2023-02-06T08:13:38Z,2023-02-06T08:13:38Z
377766,to-teach.ai,The artificial intelligence for your classes,Use artificial intelligence to create personalized materials and exercises that are tailored to the interests and and needs of your students.,https://www.to-teach.ai/,"Productivity,Education,Artificial Intelligence",https://ph-files.imgix.net/7c62cd6a-f0be-4cc6-842e-435c079e736c.png?auto=format,68,4,2023-02-06T13:29:59Z,2023-02-06T13:29:59Z
378218,LIFEZ,Unlock the power of productivity within you,"Lifez is a daily planner using advanced AI technology to provide personalized suggestions for increased focus and efficiency, helping users reach their productivity goals.",https://www.beforesunset.ai/lifez,"Productivity,Time Tracking,Calendar",https://ph-files.imgix.net/a25dd8a8-40ef-4f26-acde-4b4c395f307a.png?auto=format,59,2,2023-02-06T13:24:41Z,2023-02-06T13:24:41Z
377784,Layr,"Simpler, cheaper & safer rails to invest in crypto","Invest smarter with Layr - the crypto super app! Say goodbye to confusing interfaces and gas fees, and hello to a better experience. Layr makes it investing in crypto as easy as a couple of clicks. Onramp for free, no-gas fees, fully cross-chain, and more.",https://golayr.com,"iOS,Fintech,Web3",https://ph-files.imgix.net/b1e1a6d4-658c-441e-91c0-51ae096aed82.png?auto=format,59,4,2023-02-06T08:53:54Z,2023-02-06T08:53:54Z
377911,Frond,A better way to build community online,"Frond is a new platform for online community. Because it’s built from threads instead of chat, conversations are deeper, easier to follow, and scale automatically.",https://frond.com,"SaaS,Remote Work,Community",https://ph-files.imgix.net/ba76e70f-7867-45f7-918b-918c044efcf1.gif?auto=format,926,221,2023-02-07T08:07:52Z,2023-02-07T08:07:52Z
377309,Butter 2.0,Effortlessly run engaging sessions that people love,"Keep everyone engaged and focused on one window and one outcome. 🔥 Prep your agenda ahead of time with expert-created templates, engage participants with delightful tools, and collaborate effectively without having to juggle multiple tabs & windows!",https://www.butter.us/,"Design Tools,Productivity,Meetings,Tech",https://ph-files.imgix.net/a463d165-4316-4bcf-9777-f11139536dcc.gif?auto=format,886,468,2023-02-07T08:01:00Z,2023-02-07T08:01:00Z
377472,NLP inside your database,Query OpenAI’s GPT-3 from directly inside your database,"You’ve explored the power of GPT-3 & ChatGPT; now you can apply that power to your own data by bringing GPT-3 to your database with MindsDB, to deliver additional insights & value to your existing data. MindsDB is an Open-Source ML Platform for Developers",https://mindsdb.com/natural-language-processing-in-databases,"Open Source,Developer Tools,Artificial Intelligence",https://ph-files.imgix.net/a37110f8-eada-49ce-b9fe-e9f676791e0f.gif?auto=format,842,375,2023-02-07T08:01:00Z,2023-02-07T08:01:00Z
378324,Bard,Google officially announces ChatGPT competitor called BARD,"The tool will be powered by the company's Language Model for Dialogue Applications (LaMDA) — yes, the same one that one of its engineers said had come to life last year, prompting the company to fire him. https://www.aitoolhunt.com/",https://blog.google/technology/ai/bard-google-ai-search-updates/,"Productivity,Artificial Intelligence,Tech",https://ph-files.imgix.net/c0c52854-851b-4b24-9b68-560857081e01.png?auto=format,750,44,2023-02-07T08:00:00Z,2023-02-07T08:00:00Z
378389,ConversAI,Respond to anything in 1 click with the smart chat assistant,ConversAI is the personal AI chat assistant that helps you respond to anything with just one click. Let AI carry the conversation and never run out of interesting things to say!,https://conversai.co,"Twitter,Social Media,Artificial Intelligence",https://ph-files.imgix.net/75175a65-401f-4b9a-9fb0-0dbfebb3e158.png?auto=format,499,140,2023-02-07T08:00:31Z,2023-02-07T08:00:31Z
378323,AI for Sheets by Cargo,The OpenAI add on for sales and marketers,Supercharge your Spreadsheets with AI ⚡⚙️ Automate hours of work in seconds 🙌 30+ ready-to-use templates made by the community ✅ Write your own prompt and run it on your entire spreadsheet in a matter of seconds,https://www.getcargo.io/ai-for-sheets,"Productivity,Spreadsheets,Artificial Intelligence",https://ph-files.imgix.net/53e98c33-8000-493f-89c7-6c733f37a4ad.png?auto=format,443,80,2023-02-07T08:05:39Z,2023-02-07T08:05:39Z
377922,BotDisco,The most customizable No Code bot for your Discord,"BotDisco, a no code bot builder for Discord. It uses triggers and actions, so your bot can be highly customizable for your community.",https://www.botdisco.com/,"Social Media,Analytics,Marketing",https://ph-files.imgix.net/c10a0da9-7e8c-427c-b05c-e1d6e302a09c.png?auto=format,379,63,2023-02-07T08:01:00Z,2023-02-07T08:01:00Z
378054,Cody,The magic of ChatGPT but trained on your business,"Cody is an AI assistant like ChatGPT - with the added benefit of being able to train it on your business, your team, your processes, and your clients. Use Cody to support your team by answering questions, analyzing information, and brainstorming ideas.",https://meetcody.ai,"Productivity,Artificial Intelligence,Bots",https://ph-files.imgix.net/9b3f64d2-0ea3-4c2a-bf16-4876faa9ee83.png?auto=format,302,26,2023-02-07T08:07:59Z,2023-02-07T08:07:59Z
378254,Marquiz,High conversion quiz builder,"At all those times your customers get muddled in options and doubts, start with a question. Marquiz lets you build quizzes and surveys to get more ""high-intent"" leads without increasing your ad budget.",https://www.marquiz.io/,Marketing,https://ph-files.imgix.net/19dacd20-9991-4e01-980e-2c64764b0c05.png?auto=format,290,125,2023-02-07T08:07:33Z,2023-02-07T08:07:33Z
378390,Liveblocks Starter Kit,Kickstart your Next.js collaborative application,"The Liveblocks Starter Kit for Next.js helps you kickstart your&nbsp;real-time collaborative app in minutes. Real-time collaborative editor, private drafts, browse and share documents, + more! → liveblocks.io/starter-kit",https://liveblocks.io/starter-kit,Developer Tools,https://ph-files.imgix.net/d586cc90-2730-4220-b86c-51b0a3ac12d0.gif?auto=format,281,117,2023-02-07T08:02:46Z,2023-02-07T08:02:46Z
378330,Design System Automation by Anima,Bring your code into Figma,"Anima turns your code components in Storybook into a Figma library! And, keeps them continuously synced. Code props become Figma variants, CSS turns to AutoLayout, design tokens to Figma styles. Join us for the live launch event today! https://bit.ly/animadsa",https://www.animaapp.com/use-cases/design-systems,"Design Tools,User Experience,Developer Tools,Artificial Intelligence",https://ph-files.imgix.net/9e13de2b-cde7-4d32-be80-bfb7f1b3b055.png?auto=format,272,29,2023-02-07T08:04:08Z,2023-02-07T08:04:08Z
378306,lofi.life,"Relax & code with ambient sounds, a timer & to-do list",Immerse yourself in tranquil background sounds & stay focused with the help of an integrated Pomodoro timer & convenient to-do list. Say goodbye to scattered thoughts & hello to a more relaxed & efficient coding experience.,https://lofi-life.vercel.app/,"Design Tools,Productivity,Developer Tools",https://ph-files.imgix.net/6dfc3fb6-ef73-4824-9775-6cc9e3c9c3d2.png?auto=format,262,45,2023-02-07T08:00:00Z,2023-02-07T08:00:00Z
377906,blockbank,Unleashing financial power with AI & blockchain technology,"blockbank: Where innovation meets finance. Experience the future of Digital Asset Management and Banking with our cutting-edge blockchain platform that combines security, transparency, centralized and decentralized solutions.",https://blockbank.ai,"Android,Crypto,Web3,Finance",https://ph-files.imgix.net/f9620ea2-ace6-42bf-aba0-1987b09322d8.png?auto=format,253,112,2023-02-07T08:06:22Z,2023-02-07T08:06:22Z
378539,Fitbots OKRs and KPI software,Drive 10x growth with OKRs. Measure & scale with KPIs,"Fitbots OKRs and KPIs software is designed to help organizations align their goals and track their performance. It's easy to set, track, and manage both OKRs and KPIs. If you are new to OKRs we have a built-in OKR Course to help you get started.",https://www.fitbots.com/,"Productivity,SaaS,Product Hunt",https://ph-files.imgix.net/6e9bfada-f2ce-4f00-900b-14495ac9649e.png?auto=format,240,33,2023-02-08T03:41:06Z,
377848,Rentle,World's first circular commerce platform,"Rentle is a fit-for-purpose white-label commerce platform for circular economy and recommerce. Both small merchants and global retailers use Rentle to launch and scale subscriptions, rentals, and buyback-driven second-hand sales.",https://www.rentle.io,"Website Builder,E-Commerce,Climate Tech",https://ph-files.imgix.net/3a27c792-0e57-470c-9c86-00a9f927f65d.gif?auto=format,230,26,2023-02-07T08:05:07Z,2023-02-07T08:05:07Z
378225,KNO by Alltius,Get answers to your curiosity - quick & precise,"KNO is a generative AI based ask-anything assistant. It gives quick, bite-sized and precise answers. Going forward, one can ingest information into KNO, coach it and deploy as an ultra-powerful no-code assistant for support and sales in SaaS.",https://www.alltius.ai/products/kno-for-slack,"Productivity,SaaS,Artificial Intelligence",https://ph-files.imgix.net/2bbc1799-9f33-4d18-a24d-bf4ac6334649.gif?auto=format,211,45,2023-02-07T08:01:00Z,2023-02-07T08:01:00Z
378370,Ask Quran,AI powered search & references from the Quran,"Ask Quran offers a ChatGPT-style interface that allows you to ask questions and receive references from the Quran. Whether you are trying to find something in the Quran or have forgotten the reference to a particular verse, Ask Quran can help.",https://askquranai.vercel.app/,Artificial Intelligence,https://ph-files.imgix.net/ef866f18-05c1-4aaf-b4d5-66ee474de2b4.png?auto=format,192,42,2023-02-07T08:05:15Z,2023-02-07T08:05:15Z
378090,Peggy,Collect investment-grade art with the flexibility to resell,"Peggy is the social marketplace to buy and sell investment-grade art. We know that plans change—that’s why we give collectors the flexibility to rehome their art on Peggy. Powered by our AI technology, we enable royalties for artists on all future sales.",https://peggy.com/producthunt,"Android,Art,Investing,Shopping",https://ph-files.imgix.net/344cdf8e-bc45-4e52-a330-ceae08204acb.jpeg?auto=format,190,43,2023-02-07T08:01:00Z,2023-02-07T08:01:00Z
378357,Scalenut,AI that powers your entire content lifecycle,"Scalenut reduces 90% of time and drives 10x organic traffic by 🛠️automating your entire content lifecycle with AI. Keyword planning, NLP powered topic research, AI writing, content optimization and publishing - all in under one app. Try Scalenut 👉",https://www.scalenut.com/,"SEO,SaaS,Artificial Intelligence",https://ph-files.imgix.net/74730830-6fe0-4814-8d46-0c523c425129.gif?auto=format,1460,721,2023-02-08T08:01:00Z,2023-02-08T08:01:00Z
378560,Help Turkey by Ahbap,We look forward to your help for the huge disaster in Turkey,"South of Turkey was destroyed by two consecutive earthquakes at the size of 7.8 and 7.6, which occurred 8 hours apart. Besides all unfortunate losses, there are over 40,000 that are still injured and hundreds of thousands of people were left homeless with freezing temperatures outside.",https://ahbap.org/disasters-turkey,Community,https://ph-files.imgix.net/1c84801b-6d7a-4b9a-9244-a39584ecb344.png?auto=format,1288,167,2023-02-08T08:01:00Z,2023-02-08T08:01:00Z
376314,Ignition 1.0,"Automate product launch, feature releases & internal comms","Ignition is the first Go-to-Market Ops platform. It helps PMM and PM teams ensure launches drive revenue by improving repeatability and team coordination. Unify and automate research, roadmaps, GTM plans, internal comms, and measurement in one AI-powered hub.",https://www.haveignition.com/,"Productivity,Marketing,SaaS",https://ph-files.imgix.net/6da370b7-8a03-4c3e-8674-3080aaf3ae41.png?auto=format,739,218,2023-02-08T08:16:10Z,2023-02-08T08:16:10Z
378547,Microsoft Bing AI,"Your copilot for the web, powered by ChatGPT","AI-powered Bing search engine and Edge browser, available in preview now at Bing.com, will deliver better search, more complete answers, a new chat experience and the ability to generate content.",https://www.bing.com/,"Artificial Intelligence,Search,Edge Extensions",https://ph-files.imgix.net/772c3617-feb1-49fd-87f4-df72335d2f84.png?auto=format,516,28,2023-02-08T08:01:00Z,2023-02-08T08:01:00Z
378508,Early Stage Funding Knowledge System,Your systemized way to do fundraising,A system that works great for fundraising. Based in Notion.,https://heypaus.gumroad.com/l/zgccn,"Fundraising,Notion",https://ph-files.imgix.net/43eea095-dfea-4f83-bafe-7adb8580fc15.png?auto=format,471,43,2023-02-08T08:16:02Z,2023-02-08T08:16:02Z
378533,Lottie Editor,The easiest way to edit Lottie animations,"Personalize and customize an animation to your liking: with the all-new Lottie Editor. No animation experience is necessary. Effortlessly change colors, add dynamic interactions, edit layers, and ship animation across web, app, design, and social platforms.",https://lottiefiles.com/lottie-editor,"Design Tools,Graphics & Design,Animation",https://ph-files.imgix.net/20670f6c-a217-4ffc-95bd-a5b42014f3a5.gif?auto=format,408,96,2023-02-08T08:15:51Z,2023-02-08T08:15:51Z
377471,Whalesync,"2-way sync Airtable, Webflow, Notion, Bubble, & Postgres","Whalesync is a no-code tool that lets you instantly 2-way sync data across apps like Airtable, Webflow, Notion, Postgres, & Bubble. Deeply connect the tools you love in minutes to build internal tools, programmatic SEO pages, and more. http://whalesync.com/",https://www.whalesync.com/,"Productivity,No-Code,Marketing automation",https://ph-files.imgix.net/a628511a-7b43-42be-a5df-4d5ed46eb200.gif?auto=format,382,134,2023-02-08T08:01:00Z,2023-02-08T08:01:00Z
378454,Hypefury Daily,Free 90 day email course to grow your Twitter followers 10X,You get one task per day in your inbox. We tell you exactly what to do. You only have to fill in the blanks and tweet it. It takes less than 1 minute to get a tweet out. Join thousands of others in the program and see your audience grow faster.,https://hypefury.com/hypefury-daily-ph,"Twitter,Growth Hacking",https://ph-files.imgix.net/0c930d74-b959-44de-8a1f-7c49463f2d6e.png?auto=format,368,123,2023-02-08T08:18:26Z,2023-02-08T08:18:26Z
378541,Fig Scripts,"Build internal CLI tools, really fast","Use Fig's Jupyter Notebook-style interface to write scripts with code, inputs, and markdown. Capture user input with our beautiful terminal UI library. Share scripts and CLIs with your teammates instantly.",https://fig.io/scripts,"Productivity,Developer Tools,Development",https://ph-files.imgix.net/0be873a7-5ef9-486c-988d-e687909ff3e2.gif?auto=format,353,42,2023-02-08T08:01:00Z,2023-02-08T08:01:00Z
378351,Codeium,"Free AI-powered code completion for everyone, everywhere","The modern coding superpower. State-of-the-art suggestions on 30+ languages in your IDE: VSCode, JetBrains, Vim/Neovim, Emacs, and uniquely as a Chrome extension, enabling it on notebooks (Jupyter, Colab, etc), websites like JSFiddle, and web IDEs like Gitpod.",https://codeium.com/,"Productivity,Developer Tools,Artificial Intelligence",https://ph-files.imgix.net/95be593b-5dc3-4140-9bb6-95d1e47c115d.png?auto=format,260,38,2023-02-08T08:15:40Z,2023-02-08T08:15:40Z
378563,VisaJobs,Empowering immigrants on working visa,Visajobs.io is a job board designed specifically for immigrants on working visas. We use public data to estimate if an opportunity is likely to provide sponsorship. Most of the jobs are either remote or in the US for now. We might expand to include more areas in the future.,https://visajobs.io,Hiring,https://ph-files.imgix.net/949c5b3b-8ca8-4d31-adb3-71627b1045d5.png?auto=format,229,38,2023-02-08T08:18:37Z,2023-02-08T08:18:37Z
378502,Venngage Valentine Card Maker,Generate Valentine's day cards with AI,"Create unique and personalized Valentine cards with our AI card generation tool. Want to send a funny poem to your secret crush? Use our GPT-3 powered, Cyrano de Bergerac-inspired card maker tool to express yourself.",https://venngage.com/tools/valentines-day-card-maker,"Design Tools,Artificial Intelligence,Web Design",https://ph-files.imgix.net/3ded01c7-f6e9-465d-a1c2-927727cee061.png?auto=format,207,59,2023-02-08T08:02:07Z,2023-02-08T08:02:07Z
377515,Lofi.,Lofi music and time-tracking,"Lofi. (Lofi Dot) is a good design iOS app, with following: - Dot matrix style font UI. - Local Play. - Chill and Focus different states Label. - Time tracking - Widgets, Lock Screen Widgets",https://www.lofidot.com/,Productivity,https://ph-files.imgix.net/eedce438-ebf1-4a20-b134-dc15040ec41f.png?auto=format,120,15,2023-02-08T08:12:28Z,2023-02-08T08:12:28Z
378544,QuickAlerts,"Customizable, real-time notifications for on-chain events","Use QuickAlerts to define and receive real-time alerts for on-chain activities that matter for your business. Built for a variety of DeFi, NFT and analytics use cases, QuickAlerts enable you to easily set up custom feeds to monitor and take action on critical transactions, logs, and block data.",https://www.quicknode.com/quickalerts,"Crypto,Web3,DeFi",https://ph-files.imgix.net/091b07eb-41f2-46b5-a811-ae86567c9ad5.png?auto=format,118,4,2023-02-08T08:00:00Z,2023-02-08T08:00:00Z
377763,No-Code miniAccelerator,"Learn to build, build to launch & launch to make money","No-Code miniAccelerator is a 12-week online program, where you will get help not only to learn no-code skills but also how to earn money with those skills! Master the most popular no-code tools, learn how to market your business, and launch new products!",https://www.miniaccelerator.com,"Education,Tech,Side Project",https://ph-files.imgix.net/413bfca4-0a87-4183-b245-87fbd31ec265.png?auto=format,114,21,2023-02-08T08:01:00Z,2023-02-08T08:01:00Z
378583,AlphaPanda,The Best NFT Shopping Hub; Always One Step Ahead and Smarter,"With exclusive Marketing Insights, Alpha Hype Index, First-hand Minting Info, AlphaPanda detects groundswells before they surface, providing investors with the most insightful data analytics for upcoming and minting NFTs.",https://alphapanda.one/,"Analytics,Web3,NFT",https://ph-files.imgix.net/606aaf5b-a8d1-4694-aa51-98762d6b3af0.png?auto=format,108,1,2023-02-08T09:00:01Z,
374187,Buzz Mail,AI email assistant,"Buzz Mail, uses artificial intelligence to help you write better and faster email replies. Buzz Mail is a Google workspace add-on that works with all your desktop, mobile browsers and your gmail mobile app too. Sign up for early access.",https://workspace.google.com/marketplace/app/buzz_mail/650469784389,"Email,Customer Communication,SaaS,Artificial Intelligence",https://ph-files.imgix.net/b3cfeb81-7de7-4854-a3af-f3ec78bd8ea3.png?auto=format,102,34,2023-02-08T08:14:58Z,2023-02-08T08:14:58Z
378457,Crypto and Finance Template for Figma,Design your next crypto or DeFi project in minutes.,"Speed up your workflow with over a hundred of dedicated screens and components for your next crypto, DeFi, or finance project. Everything is built with the newest Figma features and the Tokens Studio plugin.",https://www.antforfigma.com/templates/finexus,"Design Tools,Crypto,DeFi",https://ph-files.imgix.net/124c197c-2ff6-4db9-90de-b60277507753.png?auto=format,77,11,2023-02-08T08:11:35Z,2023-02-08T08:11:35Z
378504,Thunder Client CLI,A new way to test APIs inside VS Code,"Thunder Client CLI provides new way to test APIs inside VSCode and and features like Integration with Thunder Client extension, VSCode Themes, Run Request and Collections etc.",https://www.thunderclient.com,"API,Developer Tools",https://ph-files.imgix.net/c81add6f-ad02-4c69-a745-0058a9da071c.png?auto=format,77,1,2023-02-08T08:12:19Z,2023-02-08T08:12:19Z
378543,Jitter 1.0,A fast and simple animation tool on the web 💫,"Create stunning animations for your videos, websites, or apps, in 3 simple steps: 1. Design → Start from scratch, Figma, or a template 🎨 2. Animate → Use presets, or create your own animations ✨ 3. Export → Video, GIF, and Lottie 🎬 All in your browser!",https://jitter.video,"Design Tools,Animation",https://ph-files.imgix.net/3b6d29ba-d93c-4bd8-9b01-2b7a3e8f2444.gif?auto=format,1432,372,2023-02-09T08:01:00Z,2023-02-09T08:01:00Z
377224,Bluelearn,The largest community of tomorrow's builders,"Bluelearn is a community of tomorrow’s builders. Find co-founders, teammates, gigs & internships. Learn new skills through events and network with passionate people from tech, design, marketing & more. Because you don’t need fancy tags to make an impact.",https://www.bluelearn.in,"Hiring,Education,Community",https://ph-files.imgix.net/04053e00-7976-428a-a3fa-10f41a768d9e.gif?auto=format,1283,355,2023-02-09T08:01:00Z,2023-02-09T08:01:00Z
378704,Support Earthquake Victims with Crypto,"10K buildings destroyed, 50K trapped, please donate crypto","Any cryptocurrency can be used to contribute to Turkey Earthquake Relief Efforts. Funds will go towards helping those impacted by the disaster through trustworthy social organization Ahbap, founded by Haluk Levent.",https://ahbap.org/disasters-turkey,"Charity & Giving,Web3",https://ph-files.imgix.net/e908fc03-c616-47ea-be16-93089bc52d7b.png?auto=format,998,140,2023-02-09T08:01:00Z,2023-02-09T08:01:00Z
378714,Stylebit 0.1,Central hub for design collaboration,"Make your design process simpler: Stylebit is a tool for teamwork and collaboration. With Stylebit, you can easily share ideas, automate tasks, develop a design strategy and keep your design system in sync. No more confusion — just smooth cooperation!",https://stylebit.io/,"Design Tools,Developer Tools",https://ph-files.imgix.net/830a117f-bb8c-4d24-96ff-352693ceb16d.gif?auto=format,519,232,2023-02-09T08:01:00Z,2023-02-09T08:01:00Z
378384,Firstbase Agent ,"Ditch the lawyers, save hours on your compliance filings","Save time on state filings, federal tax support, foreign qualification, payroll tax registration, and more — all from our comprehensive compliance solution. Let us handle the fine print so you can focus on growing your brand.",https://www.firstbase.io/agent,"Tech,Accounting,Human Resources",https://ph-files.imgix.net/b64a5d08-b266-46c5-9a1e-9fd874305ac6.png?auto=format,436,142,2023-02-09T08:01:00Z,2023-02-09T08:01:00Z
378763,Code-GPT,"Make sense of any code, anytime",Code-GPT is an extension for VS Code that provides you instant explanations for your code within the code editor using AI.,https://twitter.com/VaibhavAcharya_/status/1623555668799295488,"Developer Tools,Artificial Intelligence,GitHub",https://ph-files.imgix.net/9cd50202-8ffe-4e0a-8f4e-0f843dd85a2a.png?auto=format,428,26,2023-02-09T08:01:22Z,2023-02-09T08:01:22Z
375224,Chatbot Design Studio by Tiledesk,The community-led no-code platform for customer engagement,"The 1st no-code chatbot builder community. Design chatbots & conversational apps and share them freely. Mix & match AI with rules and a human element to bring your perfect conversation design to life 🖥⚡️💬 Without knowing how to code, open-source and for free",https://tiledesk.com/chatbot-design-studio/,"Open Source,Bots,No-Code",https://ph-files.imgix.net/1734a515-25cb-4825-94f0-7136ab0d4f23.png?auto=format,412,159,2023-02-09T08:01:00Z,2023-02-09T08:01:00Z
378777,Donate for Türkiye widget,Your website can help Türkiye earthquake,Türkiye has recently been struck by a devastating earthquake with a magnitude of 7.8. The impact has been widespread and many communities have been severely affected. Put the donation widget on your website to aid those affected by the terrible earthquake.,https://www.donateforturkiye.org/,Charity & Giving,https://ph-files.imgix.net/96f5cab5-90cb-4e8b-a37e-00284caae592.png?auto=format,261,25,2023-02-09T08:13:15Z,2023-02-09T08:13:15Z
378470,Laxis 2.0,"Auto-generate meeting memos, follow up emails, reports, etc","Laxis uses AI to automatically generate meeting memos, follow up emails, customer requirements, project updates, and more. With Laxis, your transcripts turn into follow up content in seconds!",https://www.laxis.com,"Notes,Meetings,Artificial Intelligence",https://ph-files.imgix.net/212dbc37-d6c4-4261-af51-215ba9c1ae98.gif?auto=format,199,113,2023-02-09T08:07:32Z,2023-02-09T08:07:32Z
378782,Featured Image Creator,Stunning social sharing images for blog posts in seconds,Create beautiful featured images (also known as open-graph images) for your blog posts in seconds. For free! 1. Enter a post title. 2. Upload your image and logo. 3. Click 'Generate'.,https://superblog.ai/featured-image-creator,"Design Tools,Marketing",https://ph-files.imgix.net/cb23a4dc-3231-41c6-9a4a-023f1448574e.png?auto=format,183,50,2023-02-09T09:21:33Z,2023-02-09T09:21:33Z
378739,Midjourney Prompt Tool,Easiest way to craft complex Midjourney prompts in minutes,We make it easy for creatives to craft Midjourney complex prompts while keeping the UI/UX simple to use. We just started supporting v4!,https://promptfolder.com/midjourney-prompt-helper/,"User Experience,Tech,Digital Art",https://ph-files.imgix.net/2a68499d-23b7-40a0-b2cf-d809bc0c1b31.png?auto=format,174,13,2023-02-09T08:22:58Z,2023-02-09T08:22:58Z
