id,name,tagline,desc,website,category,thumbnail,votes,comments,createdAt,launchedAt
1178,Contactually,"CRM for strengthening relationships, not managing them.",,http://contactually.com/,Tech,https://ph-files.imgix.net/d95e71d3-ac7b-457f-8441-99ebfab520cb.png?auto=format,128,16,2014-02-03T13:24:20Z,2014-02-03T13:24:20Z
1180,Share As Image,"Create micro-content, add text and your logo to any image",,https://getstencil.com/sai/,Tech,https://ph-files.imgix.net/e7ed6783-3407-44d1-9adc-6d32771f206e.png?auto=format,126,8,2014-02-12T15:46:12Z,2014-02-12T15:46:12Z
1181,Vibe for Chrome,Fastest way to know everything about your contacts,,https://vibeapp.co/chrome,Tech,https://ph-files.imgix.net/ddfe7f42-6778-4953-aad2-6457258887c6.png?auto=format,98,10,2014-02-03T15:30:02Z,2014-02-03T15:30:02Z
1185,Sensor Tower,"App Marketing made simple, using market intelligence. ",,https://sensortower.com/,Tech,https://ph-files.imgix.net/0a4891c4-5261-492e-9507-6aab228ca02d.png?auto=format,55,1,2014-02-03T16:21:46Z,2014-02-03T16:21:46Z
1186,Gitly,Discover what's trending on GitHub for specific languages,,http://gitly.co,Tech,https://ph-files.imgix.net/756a6b51-de25-432e-ae8e-005a790fcfa1.png?auto=format,62,7,2014-02-03T16:38:24Z,2014-02-03T16:38:24Z
1187,Framed,Framed retains your users and predicts the future,,http://framed.io/,Tech,https://ph-files.imgix.net/e32c133b-f4e7-4120-9e28-c492f0ba9088.png?auto=format,42,6,2014-02-03T16:52:11Z,2014-02-03T16:52:11Z
1188,Facebook Paper,A new way to consume & share your content.,,https://www.facebook.com/paper/download,Tech,https://ph-files.imgix.net/c153d266-1680-401d-987d-e1d6c153ee68.png?auto=format,4,3,2014-02-03T17:29:37Z,
1189,SuperHost,Let us take care of your Airbnb listing,,http://www.guesty.com,"Tech,Vacation",https://ph-files.imgix.net/9118e981-f51b-40d3-b081-d6be86f4795f.png?auto=format,90,9,2014-02-03T17:30:55Z,2014-02-03T17:30:55Z
1190,Paper,Stories from Facebook,,https://www.facebook.com/paper,Tech,https://ph-files.imgix.net/8aa34900-f249-4db7-8c7e-8b5f91559915.png?auto=format,2,2,2014-02-03T17:50:11Z,
1191,Rollbar,Error Tracking Software for Continuous Code Improvement,Don't lose customers due to uncaught errors and slow response. Rollbar provides full coverage across all the applications that your users depend on and love.,https://try.rollbar.com/free-trial/,"Productivity,User Experience,Developer Tools,Tech",https://ph-files.imgix.net/a977dc07-00b6-42f1-853b-4f30ea46e000.png?auto=format,84,5,2014-02-03T17:57:10Z,2014-02-03T17:57:10Z
1192,Paper (Facebook),Explore and share stories from friends—and the world,,https://apps.apple.com/us/app/paper-stories-from-facebook/id794163692,Tech,https://ph-files.imgix.net/efd1fb3b-f6b6-4c19-97a9-164f8a1fde7b.png?auto=format,3,1,2014-02-03T18:33:34Z,
1194,ProfilesIO,Get a text for every user signup so you can respond quickly.,,https://profiles.io/statistics,Tech,https://ph-files.imgix.net/07ceb463-9736-498e-b729-f2ed5867580d.png?auto=format,58,6,2014-02-03T19:20:07Z,2014-02-03T19:20:07Z
1195,OneSky,The Best Translation Service for  Apps and Websites,,https://www.oneskyapp.com/,"Safari Extensions,Browser Extensions,Web App,Tech",https://ph-files.imgix.net/82edc715-cd68-4805-9c01-03b4e5cc89c7.png?auto=format,34,2,2014-02-03T19:27:09Z,2014-02-03T19:27:09Z
1197,Origami,"a free prototyping toolkit for Quartz Composer, made by FB",,http://facebook.github.io/origami/,Tech,https://ph-files.imgix.net/ea1728ee-ec07-4a70-8781-e9d87e7888ed.png?auto=format,3,2,2014-02-03T19:59:55Z,
1198,AirEnvy,"Your short term rental, managed.",,https://www.airenvy.com/,Tech,https://ph-files.imgix.net/6c0abc1a-9f9a-4d5d-b067-3185ce61f1b5.png?auto=format,5,2,2014-02-03T21:07:21Z,
1199,Contastic,Discover who you need to reach out and what to say.,,https://www.getcontastic.com/,Tech,https://ph-files.imgix.net/1c84689b-2b38-4146-a984-0f238064dc3d.jpeg?auto=format,3,1,2014-02-03T21:40:50Z,
1201,Put.io,Hassle-free torrenting in the cloud,,https://put.io,Tech,https://ph-files.imgix.net/e234309d-0c1d-4de4-9d1a-7667845e07e1.png?auto=format,7,3,2014-02-04T03:35:47Z,
1203,VidCast,Chromecast for the rest of the web,,https://vidcast.dabble.me/,Tech,https://ph-files.imgix.net/0e5d3852-0b9f-4d43-828d-73f9690efac5.jpeg?auto=format,35,4,2014-02-04T11:14:16Z,2014-02-04T11:14:16Z
1204,Spirit,Set your Tweets to disappear with a simple hashtag,,https://twitterspirit.com/,Tech,https://ph-files.imgix.net/1c84689b-2b38-4146-a984-0f238064dc3d.jpeg?auto=format,30,3,2014-02-04T12:48:32Z,2014-02-04T12:48:32Z
1205,Refresh,An Instant Dossier About People Around You,,https://www.linkedin.com,Tech,https://ph-files.imgix.net/a2411c13-1a29-4ffe-95ad-971b2a2e0344.png?auto=format,3,3,2014-02-04T13:18:34Z,
1206,PillPack,"Parmacy that delivers a better, simpler experience.","PillPack is an online pharmacy startup, based in Boston, that delivers custom, preprinted and organized packages of all of your prescription medication. Acquired by Amazon in 2018.",https://www.pillpack.com/,Tech,https://ph-files.imgix.net/18dd096f-8d8b-4564-8d09-92dd8e89443c.jpeg?auto=format,158,8,2014-02-04T13:19:30Z,2014-02-04T13:19:30Z
1207,Instagantt,Drag and drop Gantt charts - backed by Asana,,https://instagantt.com/,Tech,https://ph-files.imgix.net/1f0d5dc1-3e74-4bb1-bbcf-cff7cf675621.png?auto=format,84,3,2014-02-04T13:45:23Z,2014-02-04T13:45:23Z
1208,Unread, An RSS Reader,,http://jaredsinclair.com/unread/,Tech,https://ph-files.imgix.net/976a250f-738e-417b-8195-a8f976a72513.png?auto=format,37,1,2014-02-04T13:50:03Z,2014-02-04T13:50:03Z
1209,Sikuli,Automate anything you can see on a screen,,http://www.sikuli.org/,Tech,https://ph-files.imgix.net/4382558f-de0e-4d9a-b2cb-b522e7ccbc3c.png?auto=format,25,3,2014-02-04T14:04:35Z,2014-02-04T14:04:35Z
1211,Widg.it,"Sell anything, anywhere",,https://www.widgit.com/,Tech,https://ph-files.imgix.net/1c84689b-2b38-4146-a984-0f238064dc3d.jpeg?auto=format,22,5,2014-02-04T14:59:37Z,2014-02-04T14:59:37Z
1212,Mixery,Learn from proven entrepreneurs,,https://mixergy.com/,Tech,https://ph-files.imgix.net/1483d632-cad1-45aa-a675-a8b97f7861e4.png?auto=format,3,2,2014-02-04T15:10:59Z,
1213,CentUp,Get paid for your content. Raise money for charity.,,https://centup.org/,Tech,https://ph-files.imgix.net/452131b2-77e6-40e6-a332-eaf45e90ae50.jpeg?auto=format,81,3,2014-02-04T16:22:08Z,2014-02-04T16:22:08Z
1214,Beyond Surge,Surge pricing for Airbnb hosts.,,https://www.beyondpricing.com/products/pricing,"Tech,Vacation",https://ph-files.imgix.net/4dec8351-99d6-4c84-86d8-64760c10f6bd.png?auto=format,27,2,2014-02-04T17:01:37Z,2014-02-04T17:01:37Z
1216,Flinto,Easily create iOS prototypes,,https://www.flinto.com/,Tech,https://ph-files.imgix.net/e3602671-8337-4111-9ac9-d6ff0bc486ae.png?auto=format,7,1,2014-02-04T19:26:35Z,
1218,Strikingly,Simple Mobile Optimized Landing Page,,https://www.strikingly.com,Tech,https://ph-files.imgix.net/215f93d2-4933-4c8f-82e5-f1ad64176099.jpeg?auto=format,106,3,2014-02-04T22:00:03Z,2014-02-04T22:00:03Z
1222,Product Hunt, a daily leaderboard of the best new products,,https://www.producthunt.com/,Tech,https://ph-files.imgix.net/1a854894-27ff-4016-9c64-f41edb53ff96.png?auto=format,11,4,2014-02-05T13:03:21Z,
1224,Loom,an alternative to iCloud for pictures,,https://www.loom.com/,Tech,https://ph-files.imgix.net/1c84689b-2b38-4146-a984-0f238064dc3d.jpeg?auto=format,13,1,2014-02-05T14:19:48Z,2014-02-05T14:19:48Z
1225,Basecamp,Keeps people on the same page,,https://basecamp.com/,"Productivity,Tech",https://ph-files.imgix.net/3b593a59-6b36-4f44-b9b4-7e43131a1287.jpeg?auto=format,162,8,2014-02-05T15:39:21Z,2014-02-05T15:39:21Z
1226,Repo,changing the way we collect links,,http://www.rrrepo.co/,"Web App,Tech",https://ph-files.imgix.net/118c4eff-9934-4e24-84f1-81380f879797.png?auto=format,23,1,2014-02-05T15:59:51Z,2014-02-05T15:59:51Z
1227,Cratejoy,The easiest way to create your own subscription service.,,https://www.cratejoy.com/,"Web App,Tech",https://ph-files.imgix.net/f6aaa9d3-4c8d-4099-9345-8d6ca010cb86.png?auto=format,126,4,2014-02-05T16:02:05Z,2014-02-05T16:02:05Z
1228,Working Nomads,"Curated delivery of remote jobs, straight to your inbox.",,https://www.workingnomads.com/jobs,Tech,https://ph-files.imgix.net/26357295-b663-4365-a163-a7cb48a5a647.jpeg?auto=format,176,3,2014-02-05T16:10:39Z,2014-02-05T16:10:39Z
1229,Abacus,Fast expense reimbursement for small businesses,,https://www.abacus.com/,"iOS,Tech",https://ph-files.imgix.net/87864beb-9534-4171-a3e7-5c168a890e56.png?auto=format,137,9,2014-02-05T16:26:53Z,2014-02-05T16:26:53Z
1230,Triaged,All your work tools in one place.,,http://ww25.triaged.co/,Tech,https://ph-files.imgix.net/1c84689b-2b38-4146-a984-0f238064dc3d.jpeg?auto=format,17,3,2014-02-05T16:31:41Z,2014-02-05T16:31:41Z
1233,Belly,Review of customer loyalty app Belly,,https://www.payprotec.com/,Tech,https://ph-files.imgix.net/9c4e5e8d-6e81-4dd2-a20b-ecfe953d3950.png?auto=format,5,4,2014-02-05T17:17:10Z,
1234,Beacon,Directly fund long form content.,,https://www.chargehound.com/,Tech,https://ph-files.imgix.net/06f2be9e-998d-457a-b36c-a9d368bd7e9f.png?auto=format,76,8,2014-02-05T17:34:32Z,2014-02-05T17:34:32Z
1235,CredHive,Store and broadcast your work at work,,http://credhive.com/,Tech,https://ph-files.imgix.net/76c4da61-b27f-465a-8329-75bffb10203d.png?auto=format,15,1,2014-11-20T01:42:56Z,2014-11-20T01:42:56Z
1237,Coinalytics,Bitcoin analytics done right.,,https://coinalytics.co/,Tech,https://ph-files.imgix.net/40843199-6a68-437e-994a-ccd2b18db3bd.png?auto=format,33,0,2014-02-05T18:44:52Z,2014-02-05T18:44:52Z
1238,Sendwithus,Create cutting-edge email experiences at scale  🚀,"Sendwithus is a cloud-based communications template management system that helps organizations maximize the potential of email to engage customers, drive growth, and increase revenue. The easy-to-use visual editor, built-in device testing, and powerful API allow for cutting-edge email strategy and execution.",https://www.dyspatch.io/sendwithus,"Email,Newsletters,Email Marketing,Marketing,Growth Hacking,Developer Tools,Tech",https://ph-files.imgix.net/c1362c66-afcf-4677-924a-0083f58e9a01.jpeg?auto=format,184,4,2014-02-05T18:48:22Z,2014-02-05T18:48:22Z
1239,Sherly,Private cloud storage behind your personal firewall.,,https://sher.ly/,Tech,https://ph-files.imgix.net/bbdd74c9-1cbc-4662-9af4-a9e5e90825c9.png?auto=format,28,0,2014-02-05T18:49:40Z,2014-02-05T18:49:40Z
1240,UI Fonts,Designers can now type icons and they'll appear.,,https://ui8.net/ui-font,Tech,https://ph-files.imgix.net/bb31e264-2167-4780-a076-511a6e56975d.png?auto=format,37,4,2014-02-05T18:51:38Z,2014-02-05T18:51:38Z
1241,OhmConnect,Airbnb for energy,,https://www.ohmconnect.com/,"Batteries,Tech",https://ph-files.imgix.net/95e67205-44bf-4287-b634-1b95cb84ea98.png?auto=format,49,2,2014-02-05T18:55:11Z,2014-02-05T18:55:11Z
1242,Belly Card,World's best loyalty program app,,https://www.bellycard.com,Tech,https://ph-files.imgix.net/667da6fa-2853-481b-a5e2-45b015c03da3.png?auto=format,34,3,2014-02-05T19:02:54Z,2014-02-05T19:02:54Z
1243,Fundera,Small Business Loans Made Easy,,https://www.fundera.com/,Tech,https://ph-files.imgix.net/c284b822-74f9-4776-b604-43e7f232d201.png?auto=format,27,0,2014-02-05T19:10:18Z,2014-02-05T19:10:18Z
1245,Teamtailor,All-in-one Modern Recruitment and Employer Branding Software,"Along with being in the Top 10 fastest growing tech companies in Sweden by Deloitte 2018, Teamtailor is being used by 1400 companies everyday. Teamtailor is the candidate focused, mobile friendly, easy to use, up to date powerful Employer Branding platform",http://www.teamtailor.com,"Hiring,Tech",https://ph-files.imgix.net/6d764ae1-df98-483b-85ba-f4882748c65d.png?auto=format,27,0,2014-02-05T19:52:06Z,2014-02-05T19:52:06Z
1247,Codewars,Improve your skills by training w/ others on code challenges,,https://www.codewars.com/,"Web App,Tech",https://ph-files.imgix.net/595542c0-4119-4af7-bd5e-2b493386199d.png?auto=format,59,1,2014-02-05T22:15:19Z,2014-02-05T22:15:19Z
1248,Baremetrics,Saas Analytics for Stripe,,https://baremetrics.com,Tech,https://ph-files.imgix.net/6d8cd0e8-be25-4fb4-afda-8c187620b703.png?auto=format,5,1,2014-02-06T00:25:32Z,
1249,404gotten,Use a 404 not found page to help a child find a sponsor.,,https://www.compassion.com/sponsor_a_child/,Tech,https://ph-files.imgix.net/d2247d21-3fe5-425d-a17a-84328c4d0494.png?auto=format,23,0,2014-02-06T00:42:56Z,2014-02-06T00:42:56Z
1250,Crowdwish,Make things happen. Every day. ,,http://www.crowdwish.com/,Tech,https://ph-files.imgix.net/b4f035b3-c6e8-480a-9d3a-6069dccff605.png?auto=format,39,15,2014-02-06T13:10:25Z,2014-02-06T13:10:25Z
1251,OMsignal,High-performance smartwear that feels like everyday wear.,,https://www.hexoskin.com/collections/all,Tech,https://ph-files.imgix.net/0d4e7416-02f6-4d8b-bf0c-b0b48e2a63f7.png?auto=format,20,1,2014-02-06T05:06:02Z,2014-02-06T05:06:02Z
1252,Boxed,Warehouse Club Shopping On Your Phone Or Tablet,,https://boxed.com/,Tech,https://ph-files.imgix.net/9f552635-7391-473e-8118-251f3e87fff4.png?auto=format,38,1,2014-02-06T09:19:10Z,2014-02-06T09:19:10Z
1253,Flattr,Support creators with micro-donations.,,https://flattr.com/,Tech,https://ph-files.imgix.net/675d5b45-139c-49f9-94a5-c7886dba5ff4.png?auto=format,4,2,2014-02-06T12:12:48Z,
1254,Tempo 1.2,Rich people insights added to smart calendar,,http://www.tempo.ai,Tech,https://ph-files.imgix.net/2945820c-36d6-4348-864d-be052516307f.png?auto=format,20,3,2014-02-06T13:10:29Z,2014-02-06T13:10:29Z
1255,Hacker Newsletter,Best of Hacker News in your inbox every Friday.,,https://hackernewsletter.com/,Tech,https://ph-files.imgix.net/3bdc65b9-52b0-4a75-9ded-eda41b4339cc.png?auto=format,179,12,2014-02-06T13:45:34Z,2014-02-06T13:45:34Z
1256,GoSquared,The simplest analytics in the world,,https://www.gosquared.com/,Tech,https://ph-files.imgix.net/15b910b4-7d7c-4673-8d8c-eb676f3096bb.png?auto=format,21,0,2014-02-06T14:03:39Z,2014-02-06T14:03:39Z
1257,Draft,Easy version control and collaboration for writers,,http://draftin.com,Tech,https://ph-files.imgix.net/80a5ef48-d0c0-4cf8-82b8-1a941d1b28cb.png?auto=format,8,7,2014-02-06T15:05:34Z,
1258,Founders School,Online educational resource dedicated to entrepreneurship,,https://www.entrepreneurship.org/en/Founders-School/,Tech,https://ph-files.imgix.net/8df9e996-eba7-4d44-85e0-691e91604d7f.png?auto=format,41,2,2014-02-06T15:19:50Z,2014-02-06T15:19:50Z
1259,SnowShoe Stamp,Create magic with a touch of plastic,,https://sparkloyalty.net,Tech,https://ph-files.imgix.net/4080d452-7223-4fb0-9bf2-1b75119131e4.jpeg?auto=format,137,37,2014-02-06T15:42:53Z,2014-02-06T15:42:53Z
1260,Amazon Flow,A new way to search for products using your iPhone camera,,https://apps.apple.com/us/app/amazon-app/id297606951,Tech,https://ph-files.imgix.net/4543f4fe-8015-41a6-aaea-bc32d18af2e4.png?auto=format,30,2,2014-02-06T15:49:09Z,2014-02-06T15:49:09Z
1261,Reporter,Understand the things you care about,,http://reporter-app.com/,"iOS,Tech",https://ph-files.imgix.net/a519198c-0594-4453-9bd8-473c44576d61.png?auto=format,76,13,2014-02-06T16:02:57Z,2014-02-06T16:02:57Z
1262,Discoverly,Facebook-LinkedIn Mashup for Chrome,,https://discover.ly/,Tech,https://ph-files.imgix.net/ee7e92ba-2b3f-4d1b-bd60-0a31a7ecdcd5.jpeg?auto=format,83,13,2014-02-06T16:05:01Z,2014-02-06T16:05:01Z
1263,Beep,Bringing Music To Every Room,,https://thisisbeep.com/,Tech,https://ph-files.imgix.net/1c84689b-2b38-4146-a984-0f238064dc3d.jpeg?auto=format,40,5,2014-02-06T16:09:06Z,2014-02-06T16:09:06Z
1264,imgix,The Image URL API is the heart of the imgix service.,"Intelligent, automated compression that eliminates unnecessary bytes. With 100+ image operations, you can achieve responsive design for any device, browser, or art direction. Get started with our free plan or choose from our flexible plans that scale with you.",https://imgix.com/,"Web App,API,User Experience,Developer Tools,Tech",https://ph-files.imgix.net/87bec2ed-3120-4c54-af7e-408cd8cfcc95.png?auto=format,100,10,2014-02-06T16:24:33Z,2014-02-06T16:24:33Z
1266,Brisk.io,Beautifully simple sales productivity,,https://www.brisk.io/,Tech,https://ph-files.imgix.net/ba3a8ec1-3b37-4f9a-ac97-58862b44e75d.png?auto=format,62,2,2014-02-06T16:46:55Z,2014-02-06T16:46:55Z
1268,nombre,Easy way to use people's first names in your Tweet replies.,,https://ninjasandrobots.com/get-more-twitter-followers-with-nombre,Tech,https://ph-files.imgix.net/76301a28-8974-429e-8db6-a7bfbd9896ff.png?auto=format,22,7,2014-02-06T18:17:23Z,2014-02-06T18:17:23Z
1270,TL;DR,"Interesting content, summarized by real people",,https://tldr.io/,Tech,https://ph-files.imgix.net/9d00bb7e-9947-460c-80cc-48d90035df14.png?auto=format,40,4,2014-02-06T18:34:30Z,2014-02-06T18:34:30Z
1274,Rookie.com,"Sports Stories Told by the Players, Coaches, and Insiders",,https://rookie.com/,Tech,https://ph-files.imgix.net/e3eb6b3a-b771-4f23-bdb5-d0b55fb7b3bd.png?auto=format,14,3,2014-02-06T21:02:39Z,2014-02-06T21:02:39Z
1275,Klout,Introducing the #NewKlout.,,https://khoros.com/platform/klout,Tech,https://ph-files.imgix.net/27873f5b-a54b-47a0-a276-c3f21caa120c.png?auto=format,49,4,2014-02-07T13:51:22Z,2014-02-07T13:51:22Z
1276,Trance,The Social Dancefloor (pre-launch),,http://www.tranceapp.com/,Tech,https://ph-files.imgix.net/1fc7126f-6832-4aa1-b809-249c50e1d917.png?auto=format,14,9,2014-02-07T13:15:56Z,2014-02-07T13:15:56Z
1278,Zinc.io,Order Anything on Amazon (or Most Retailers) via an API,,https://zincapi.com,Tech,https://ph-files.imgix.net/31680e1d-982c-49fc-8eed-93d1bd1a7233.png?auto=format,39,1,2014-02-07T10:13:43Z,2014-02-07T10:13:43Z
1279,sush.io, Smart Dashboard for the SaaS Generation (500+ Integrations),,https://www.sush.io/producthunt,Tech,https://ph-files.imgix.net/e60b0f30-329b-4195-a750-8dadb2ccfde4.png?auto=format,6,3,2014-02-07T10:33:35Z,
1280,Brackets,Code the Web,,https://brackets.io/,"Design Tools,Tech",https://ph-files.imgix.net/0c4833a3-0491-4962-a502-56235fe4a47f.png?auto=format,105,5,2014-02-07T10:37:26Z,2014-02-07T10:37:26Z
1281,PressFriendly,The better way to do PR.,,https://www.pressfriendly.com/,Tech,https://ph-files.imgix.net/18593623-0382-4295-89e2-d8f06155c51a.png?auto=format,72,13,2014-02-07T11:02:29Z,2014-02-07T11:02:29Z
1283,Freemium Economics,A nuts and bolts guide to Freemium,,https://www.amazon.com/Freemium-Economics-Leveraging-Analytics-Segmentation/dp/0124166903/,Tech,https://ph-files.imgix.net/1c84689b-2b38-4146-a984-0f238064dc3d.jpeg?auto=format,22,8,2014-02-07T14:10:22Z,2014-02-07T14:10:22Z
1284,Now I Know,"Learn something new every day, via email",,https://nowiknow.com/,Tech,https://ph-files.imgix.net/f2143ba1-951d-4699-a77c-e41d71a8ed2c.png?auto=format,78,13,2014-02-07T15:13:45Z,2014-02-07T15:13:45Z
1285,Oscar Health (iOS),A modern health insurance company powered by technology,,https://apps.apple.com/us/app/oscar-health/id781584599,"iOS,Tech",https://ph-files.imgix.net/34b5e5c5-b1c1-4c6e-8e7d-da26d68f313a.png?auto=format,40,0,2014-02-07T15:49:30Z,2014-02-07T15:49:30Z
1286,Harvest Exchange,Public market investor community and news network,,https://www.hvst.com/,Tech,https://ph-files.imgix.net/75c59147-2949-4da9-b702-760f0490ea9a.png?auto=format,14,2,2014-02-07T16:23:54Z,2014-02-07T16:23:54Z
1288,Shake,"Create, sign, and send legally binding contracts in seconds.",,https://forms.legalshield.com,Tech,https://ph-files.imgix.net/26cb0a36-825a-4d9f-b64d-db09dfa19b7f.png?auto=format,2,2,2014-02-07T17:23:23Z,
1289,BloomThat,"Ridiculously fast, handcrafted flowers on-demand",,https://www.ftd.com/bloomthat,Tech,https://ph-files.imgix.net/6c94d3ba-8a36-4ae0-b407-222a3cdaafd7.png?auto=format,4,2,2014-02-07T18:03:13Z,
1290,ProFlowers (iOS),ProFlowers app from Sincerely acquisition,,http://www.proflowers.com/downloadapp,Tech,https://ph-files.imgix.net/6c526855-cfea-420a-98c6-26c8877aa810.png?auto=format,6,1,2014-02-07T18:04:43Z,2014-02-07T18:04:43Z
1291,Do What You Do,"Monkey Inferno Speaker Series, featuring Evan White today",,https://www.eventbrite.com/e/dwyd-evan-white-tickets-10520351655,Tech,https://ph-files.imgix.net/437591b7-1cac-4c4f-9398-588eb9b8ac81.png?auto=format,10,2,2014-02-07T19:23:19Z,
1292,LockerRoom,A simple way to download your dribbble likes,,http://bilambee.com/lockerroom/,Tech,https://ph-files.imgix.net/1c84689b-2b38-4146-a984-0f238064dc3d.jpeg?auto=format,21,0,2014-02-07T21:47:22Z,2014-02-07T21:47:22Z
1295,XStat,Stops bleeding from gunshot wounds in 15 seconds,,https://www.revmedx.com/,Tech,https://ph-files.imgix.net/512fe25e-2a75-4103-a9df-986a5da49969.png?auto=format,34,5,2014-02-08T08:35:49Z,2014-02-08T08:35:49Z
1296,Tapes for Mac,Share screencasts fast.,,https://usetapes.com/,Tech,https://ph-files.imgix.net/1737f806-95e2-4802-917a-a3db41ab73f4.png?auto=format,22,1,2014-02-08T11:48:15Z,2014-02-08T11:48:15Z
1297,Ultravisual,Beautiful visual publishing.,,http://ultravisual.com/,Tech,https://ph-files.imgix.net/80076acf-0728-45e3-8047-2bf2a3f8ff55.png?auto=format,25,2,2014-02-08T12:22:38Z,2014-02-08T12:22:38Z
1298,Percolate,Create better content,,https://percolate.com/,Tech,https://ph-files.imgix.net/0bb5f7c8-3552-4683-9c9b-4a077c440c32.png?auto=format,45,2,2014-02-08T16:22:05Z,2014-02-08T16:22:05Z
1300,Popcord,Unforgettable keyring charger,,https://www.kickstarter.com/projects/powergoat/popcordtm-the-cable-you-wont-forget-iphone-and-mic,Tech,https://ph-files.imgix.net/fe7b41d8-7812-4470-8615-db350066e47a.png?auto=format,15,0,2014-02-08T19:06:13Z,2014-02-08T19:06:13Z
1302,Fat Squirrel,Flappy Bird is dead. Long live Fat Squirrel!,,https://play.google.com/store/apps/details,Tech,https://ph-files.imgix.net/2b926a31-24f8-47e6-bcbe-50195b6e0eea.png?auto=format,14,13,2014-02-09T18:03:21Z,2014-02-09T18:03:21Z
1303,Siteinspire,Gallery of good looking websites,Siteinspire is a showcase of the finest web and interactive design,https://www.siteinspire.com/,"Web App,Design Tools,Tech",https://ph-files.imgix.net/d08c7a9a-e90f-4bc3-80e6-7964f95ec177.png?auto=format,79,5,2014-02-09T20:38:24Z,2014-02-09T20:38:24Z
1306,Flappy Bird Shirt,Never forget. 2/9/2014.,,https://teespring.com/never-forget-flappy-bird,Tech,https://ph-files.imgix.net/6428c54d-d839-484b-9e9e-3ca7a0a3188f.png?auto=format,6,1,2014-02-10T03:38:38Z,
1307,typeform,simple and pretty questionnaires ,,https://www.typeform.com,Tech,https://ph-files.imgix.net/7bd39e8a-57f1-4d17-8cec-f50fd37ea387.png?auto=format,11,3,2014-02-10T05:01:06Z,
1308,Zapier,Connect and automate 500+ web apps,"Easy automation for busy people. Zapier moves info between your web apps automatically, so you can focus on your most important work.",https://zapier.com/,"Web App,API,Tech",https://ph-files.imgix.net/17c844d4-a766-400c-9e7b-666276b3212f.png?auto=format,1494,31,2014-02-10T11:10:40Z,2014-02-10T11:10:40Z
1310,The Intercept,"Fearless, adversarial journalism.",,https://theintercept.com/,Tech,https://ph-files.imgix.net/f73264e9-1892-499c-bab6-579846e81656.png?auto=format,19,5,2014-02-10T14:56:15Z,2014-02-10T14:56:15Z
1311,Vero,The easiest way to send data-driven emails ,,https://www.getvero.com/,Tech,https://ph-files.imgix.net/1c84689b-2b38-4146-a984-0f238064dc3d.jpeg?auto=format,4,4,2014-02-10T15:17:14Z,
1312,CodePath,"Free, in-person Android or iOS development bootcamp",,https://www.codepath.org/,"Android,iOS,iPad,Tech",https://ph-files.imgix.net/075bde6a-08ff-4509-b245-4571087f0f55.png?auto=format,53,4,2014-02-10T15:24:28Z,2014-02-10T15:24:28Z
1313,Chathouse,Chatrooms with friends!,,https://apps.apple.com/us/app/chathouse/id791898298,Tech,https://ph-files.imgix.net/d79139ed-42a0-4d5d-8be5-43d6a40154d0.png?auto=format,24,3,2014-02-10T16:01:22Z,2014-02-10T16:01:22Z
1314,Papertrail,"Instantly manage logs from 2 servers... or 2,000.",,https://www.papertrail.com,Tech,https://ph-files.imgix.net/9f5ada9d-52a0-4585-8b95-9db74d12c358.png?auto=format,30,2,2014-02-10T16:24:23Z,2014-02-10T16:24:23Z
1315,Geeky Sprinkles,"Steampunk, Policebox, Lightning",,https://www.kickstarter.com/projects/geekyhostess/geeky-sprinkles-fun-sprinkle-shapes-for-geeky-baki,Tech,https://ph-files.imgix.net/99c5b223-c264-493e-99a8-85df00590645.png?auto=format,4,1,2014-02-10T16:37:10Z,2014-02-10T16:37:10Z
1317,Iron Worker,"Background jobs, so you dont have to",,http://www.iron.io/,Tech,https://ph-files.imgix.net/a79b9f83-9df3-4506-835f-9d54455c9b09.png?auto=format,14,1,2014-02-10T17:29:04Z,2014-02-10T17:29:04Z
1318,Dash,Instant offline access to 130+ API documentation sets.,,https://kapeli.com/dash,"Developer Tools,Tech",https://ph-files.imgix.net/ecff92e9-beae-49b6-bd38-b2650672e636.png?auto=format,225,16,2014-02-10T17:55:00Z,2014-02-10T17:55:00Z
1319,Tools for Reporters,A newsletter with awesome tools for storytellers,,http://toolsforreporters.com/,Tech,https://ph-files.imgix.net/60fd33d5-3d76-4347-8438-2e170c7404b6.png?auto=format,20,8,2014-02-10T18:39:31Z,2014-02-10T18:39:31Z
1320,Hitlist,Personalized flight alerts and deals ,,http://www.hitlistapp.com/,Tech,https://ph-files.imgix.net/042e6d34-117c-42f1-90d4-84e2546666fc.png?auto=format,92,8,2014-02-10T18:43:37Z,2014-02-10T18:43:37Z
1322,Water-Gen,Drinking Water. Anywhere.,,https://www.watergen.com/,Tech,https://ph-files.imgix.net/7b407c2e-abb0-4b02-a5ca-7289140af57b.png?auto=format,10,2,2014-02-10T19:24:13Z,2014-02-10T19:24:13Z
1323,EmailFinder,Get a valid email address with only a name & organization,,http://www.emailfinder.io,Tech,https://ph-files.imgix.net/4bc2fbcf-8260-4b4f-a255-5d1ec44ea896.png?auto=format,78,8,2014-02-10T19:47:19Z,2014-02-10T19:47:19Z
1324,Mark One,3D print carbon fiber reinforced composites.,,https://markforged.com/,Tech,https://ph-files.imgix.net/eec46f90-7176-4ad7-80fb-13115f87db9d.png?auto=format,27,0,2014-02-10T19:51:07Z,2014-02-10T19:51:07Z
1326,Main Street Genome,Operations research optimization for small businesses,,http://mainstreetgenome.com/,Tech,https://ph-files.imgix.net/0ee22a5b-62ea-4f24-9076-8f2724ac7b6f.png?auto=format,6,1,2014-02-10T22:52:36Z,2014-02-10T22:52:36Z
